,text,new_label
0,"just had a real good moment. i missssssssss him so much, ",0
1,is reading manga  ,0
2,  -  ,0
3," Need to send 'em to my accountant tomorrow. Oddly, I wasn't even referring to my taxes. Those are supporting evidence, though. ",0
4,ADD ME ON MYSPACE!!!  myspace.com/LookThunder,0
5,so sleepy. good times tonight though ,0
6," re: nbn as someone already said, does fiber to the home mean we will all at least be regular now ",0
7,23 or 24ï¿½C possible today. Nice ,0
8,nite twitterville  workout in the am  -ciao,0
9," Night, darlin'!  Sweet dreams to you ",0
10,Good morning everybody! ,0
11,Finally! I just created my WordPress Blog. There's already a blog up on the Seattle Coffee Community  ... ,0
12,kisha they cnt get over u til they get out frm under u just remember ur on top ,0
13," Yes i remember that band, It was Awesome, Will you please reply ",0
14,I really love reflections and shadows ,0
15, ooo it's fantasy?  i like fantasy novels   will check it out,0
16," no probs, I sell nothing other than my blog   I'll have to get a listen to your band, on iTunes?",0
17, NOKLA connecting people ?? ???????  ??????? ,0
18,Once again stayed up to late and have to start too early  It is a good thing I like my job,0
19,"_Penn I just read about your new job, CONGRATULATIONS!  That's fantastic.",0
20,haven't been able to sleep at ALL. i think i'll watch Ugly Betty online. ,0
21,woo thanks ron and steeve for following me yeow i have folowerssss  haha  p.s i wanna got to the ellen show ,0
22, yeah sure but its my sister's so take EXTRA gd care ,0
23,_the_mouse yay! a duck! if i want anything watching me it'd be a duck!  lol,0
24,smaaack that ass! hahhahahaa  i make myself laugh!! oOooOh sleeeep! ahha g'niite!,0
25,woo. its late! haha  goodnight twitterverse! xoxo,0
26,Looking forward to the meeting with Pastor Kong and JW later! ,0
27, u know those minichocolates in the shape of liquor bottles? with liqour inside em ,0
28,Testing to see if twitter works thro facebook ,0
29,NIGHT babies. Got a VH1 thing in the am  Check out my pics!   ,0
30,got the magic numbers and is thanking y'all for the support ,0
31,"it's cold, man am i loving this weather ",0
32,"Ok guys - we've officially launched new languages Swedish and Russian - really fun, if you ask me!  ",0
33,The lady who bought the bracelet pictured as my twitter page background is still wearing it a week later -- hasn't taken it off. Likes it ,0
34,@ DwanB i ate filet american this morning  and i cant see your pic on mobile twitter,0
35,booked my hair appointment ,0
36,"My Report Was: English: B-, Modern History: A-, Geography: B, Maths B: B-, Accounting: A and IPT: A      ",0
37,"  lol, me too....    You do know that the sound of your voice is great ?  We only need to do some euh fine-tuning... ",0
38,Cupcake heaven!   check out the shop!  nice design  (weird contact info popup tho),0
39,Bought the MH bundle? Create a task called Mario or Star Wars in The Hit List. Make sure your sound is on and complete the tasks! ,0
40,someone turn on the shower please!! ,0
41, yeah there are so many of us angry feeters  Tim's THAT good lol... I have been good I go on I  just havent posted for a while,0
42, love the new song. and the chorus is real nice and catchy.  gud job. who did the track and recording jordan?,0
43, alrite thanxx ,0
44, Looking forward to the new website ,0
45, awww sweetness! But he's still a cutie! ,0
46,  ohhh sending loads of Positive vibes your way ,0
47, Cool stuff! ,0
48,Celebrating a minor banking triumph (that's banking with a b). Got one to admit it was wrong ,0
49, Thinking of you. Everything crossed  Turn baby turn!,0
50, I'd forgotten about that  We need to do that again sometime.,0
51, Eclipse is awesome  it's better than new moon,0
52,Tired today - drunk husband to be rolled in at 1am with bunch friends for another drink! Noisy lot ,0
53," well it is definitelly worth trying, you'll notice the difference. But it's not my favorite neither ",0
54, good morning Miley ,0
55,Finished my first shift and doors are opening already! ,0
56,Nothing quite like finding good amp settings from a solid state amp ,0
57,_lo is it paid? i was made redundant two weeks ago and need a job big time. ,0
58,Watching the steam trains go back and forth in Ravenglass - sunny! ,0
59,_ski how bout  some Steppenwolf - Magic Carpet Ride? ,0
60, haha maxxie beat whippet ,0
61,Yaaaaay. Jac is training my sorcerer to level 35. That means I'll be pwn soon. ,0
62,My doggy is so cute. ,0
63, Tell her Simon  used to be from Tuks FM says Hi ,0
64,@ WildstarB - Happy Rezday Captain   - and that was quite a party!,0
65,"this car is costing me an arm and a leg, but it's so cute I have to forgive it! ",0
66,tweeting from cracker barrel  ,0
67,"_Amy_Said Phillip Schofield! The Schofe! He's a legend, Amy, you need to follow him  he's on my page.",0
68,is about to check out his new techno records from juno ,0
69,  Too funny!,0
70,i have to go now.... make up duty for tomorrow...... goodnight to all.... ,0
71, Yes mam! There's nothing like starting the day with a good song and a few dance moves ,0
72,going to paint my nails then get some foood ,0
73,Is in Athens ,0
74," as in, someone would figure out how to access the mp3s without actually paying for them. ",0
75, oh crap! i'm sure they won't dare charge for customer care in India though ,0
76,is handmade goodness at the moment  xxx,0
77, brownies are good any time of day ,0
78,Checking myspace while looking at bands from different states so i can add them as friends on myspace  I LOVE MUSIC!!!,0
79,"Happy Birthday to my Grandpa.  He has 3 cats, but I still love him. ",0
80, your nose is clogged? use a plunger then ,0
81," huy, matulog ka na. hahah. CBroom ain't done yet, but it's taking shape ",0
82,  it couldn't have come at a better time,0
83,2 days of school left this week and im beyond excited for saturday!!!! ,0
84,Just a simple girl..oatmeal makes me really happy in the morning..and the blooming wisteria ,0
85," I'm fine, thank you.  Keep being beautiful always. ",0
86," thats beautiful, what a lovely thing to say ",0
87, Change your name to Michelle. ,0
88,_ yay!!! well dont i feel spesh! ,0
89,Another year older today!  At least it's sunny out! ,0
90," yep, but we fought back well. think it will turn out to be the decisive moment in winning the league again though ",0
91, Thanks. I've lived in Florida since 1994 and I miss snow ,0
92,goin abroaaaaad tomrow.. Dubaiiii Can't wait... So long twitters... I only have room for prodigy  sorry peeps!,0
93," lol, he has no shame ",0
94, do y' mean M.C Escher (the painter not the DJ ,0
95,": I wish school was like those revision sessions. Classes of 10 in non-uniform, able to have a laugh and learn at the same time.  ",0
96,Nothin' like a good book and some spring cleaning.  ,0
97," Thanks, appreciate your feedback ",0
98,i'm listening MUSIC ,0
99," hi Mileeey! my friend and I can't wait to your come to Spain! we are so excited! we love all of your songs, all are great ",0
100, Another big table touch screen  WOOT ,0
101," No, no. You are mistaken. My uncle is the PM of Angamali. Any of these anTWIcs there, and you are gone case!  shavam",0
102, Cause we don't have Gems ,0
103,"The official result came out, PR won 2 seats whereas BN only 1 seat. Congratulations PR! ",0
104,  Thx for  the advice! We are just waiting for the Petosin to kick in ,0
105,"Im playing hooky from work today, my voice is really gone tho so im @ home today ",0
106,I love spontaneous road trips ,0
107,I'd love to tweet all day today but I have work to do that must get done so I'll tweet when I can. God bless everyone!  tcot,0
108, Is it Friday yet??  How are you baby?  tweepletuesday followfriday,0
109,Am taking advantage of the sunshine and am going to take the dog on the beach for a walk...no work for 12 days....yipeeeee ,0
110,"... still employed, no trouble there      it's other stuff that's not as sweet",0
111,Let's see how well this 2.5 hours of sleep holds me today.  I predict a massive slowdown by 14:30.  That should be funny. ,0
112,"came back from seeing 17 againn,, was gooddd  3",0
113, Maybe... just maybe! ,0
114, Sooo I just watched Disaster Movie ABSOLUTLY HILARIOUS!!!  Ur my idol ,0
115, I am happy you and mandy had a safe trip.  I have never been to VA Beach.. Enjoy ,0
116,  I'd sign up for the extra credit ,0
117,Falling asleep here. So goodnight everyone ,0
118," I've been living in Twitter API land for too long, over there we call it the oauth buttons  ",0
119,me and my mates are gunna chekk out a movie next week..i really want to see the boat that rocked. ,0
120,"  I TOTALLY AGREE WITH YOU, ANNA!! ",0
121, Follow us so we can contact you! ,0
122,I love a good book ,0
123,"With my sister from another mister, Kayla ",0
124,i will be the sun in your sky. i will light your way for all time. promise you. for you i willll.. ,0
125, that sounds like a pretty good night to me ,0
126,"according to the rosters, this hockey season won't be so bad after all  hah.",0
127,Happy Gilmore is on ,0
128,_carter Lmao. I guess its only Friday. My bad ,0
129," I wish I wasn't following you so I could be your 1,000 follower, Wayne ",0
130,"Time for a shower and french toast. No, not together. ",0
131, daamnn...:| im not even going to ask if it was boring...come to hk? ,0
132,Today is Thunder Over Louisville - the start of the Derby Festival.  I love being here for the festivities even if I'm not going.  ,0
133,"Good mornin folks, I think I'll make a couple of home made egg mcmuffins to go with this excellent coffee on this clear sunny 58* mornin ",0
134,thinks that Kellan Lutz is hot when he smokes ,0
135,"Okay, have torn apart my work. Fresh coffee  peanut butter toast then I'll try and put it back together again. Only less crap this time ",0
136,"Relaxing before guests come, hope everyone likes  the food ( I know Morton won't) have made plain rice for him ",0
137, me hair ain't Red its da light its blonde and black!   Hey Hotty!   who da other girl?,0
138,Today is the day ,0
139,"Shopped Queen St in the sun yesterday, likely the last time for a while, I need to find the SF equivalent of that experience!   ",0
140,Backgammon then a birthday meal for a friend later on ,0
141," HOLLA!!! Just chilling, on my way to buy some maple syrup (mmm..). What's up with you? Hope you're having a great morning ",0
142, Looks ok now.  only bits and bytes.  clean with Ho'oponopono too?!,0
143, serious business ,0
144, ...You made na your Twitter! Haha. D Upload a photo.  UPDATEEE! ,0
145, heyy! aww thanks so much hun you rock! xoxo ,0
146,"  heidiii, i love your new single Blackout--amazing! I think you dress amazinggg im so jealous haha. please answer something ",0
147," I was tempted this morning. I randomly woke up at 5:30, but I had just fallen asleep after 2. My sanity is more important. ",0
148, great photographs! saw you guys play at the westjet street party. short set but awesome nonetheless ,0
149," i really liked it! i'm ur 1 fan i loved all of ur movies! especially 'she's the man', it's so funny! I LOVE IT!  3",0
150,  right back atchya!! Hope you're having a great day.,0
151,just got out of the showerrr! myspacing! ,0
152,is gonna hang out with my two favorite people now.  ,0
153,pipe down. calling  ,0
154, lmao i love me a good comedy ,0
155, and  Thanks for following! ,0
156, ,0
157,Twittering .  And looking for Miley Cyrus LUv her ! xo,0
158,  hey kim im a  huge fan! ur like my role model and i really hope i can actually meet u one day.  ,0
159,is going outside ,0
160, oh demi. that sure was a knee slapper. ,0
161,Is with alyssa ,0
162, Hi luv! Sounds like you had a busy day! Hope all went well. ,0
163,Watching the brady bunch ,0
164,going out to the mall once again ,0
165,mad at  and  for completing our mission without me! but app was so good  and very pretty!,0
166,I LOVE the sound of breaking glass! Something very cathartic about it!! ,0
167,Boulder creek with gram ,0
168,  i love you baby... ,0
169," I'm just the retweeter  I personally believe the Tweet Effect, and the weekly purge, will take care of these things for me...",0
170,  Aw. have a safe trip sweety. ill miss you more  ox,0
171, Well pizza... but that is good too! ,0
172,QOTD: Hey - I still haven't told you guys the story about the English Heritage fella and how he's lucky to be still alive!  ,0
173,"I'm still sitting here. Maybe I'll go get some air, I seriously need help, my life is almost as cluttered as my room! ",0
174, Can I come?  I could use a nice decadent party. ,0
175,around. ,0
176, I LOVE YOU SELENA GOMEZ... You're so beautiful! You're my role model and my idol! I would be so happy if you reply to me ,0
177, My Mommy is here!!!!! ,0
178,Having a beer  corn dog (I know weird combo) @ the Santa Monica Pier. ,0
179, Hm. So I take it the essays are not going so well right now? Perhaps a swap? I have nothing left to lose lol ,0
180,tweetup afterparty at genji ,0
181,Back to work for me... Twitt ya'll laterz ,0
182,going to church ,0
183,"_Joker Yeah, now that im done puking crown and coke ",0
184, i know im not normally on here but il though il be cool and see what is happening on the world of twitter ,0
185,"and wife are shopping at the Great Mall in Milpitas. Great prices for us, with the dollar still reasonably low for us... ",0
186,goiing to reedbox to get some moviies ,0
187,  good thing P  K have their day jobs!  ,0
188, and sorry again for spamming...having trouble mashing out multisyllabic words with my hate fingers ,0
189,Statesboro fun this a.m. and I'm off to see the GreenJackets in Augusta tonight! ,0
190,"_kelly The fact that you didn't know the library closed at 6, NOT LAME.   ",0
191," oopssss i forgot to put ypur link at the beginning, it was to you haha in case you didn't realise. Hope you're feeling better ",0
192,hi   ! I would suggest music of my electro project ***  *** free download  have fun  cheers,0
193," Aw. Well if u ever feel like flying over 2 con it up i'll help u find a place 2 crash... I once flew 2 London 4 a Buffy con, btw. ",0
194,just had a fabulous 1.5 hr run in the desert with MIssy and Kaya and is now off to run some errands before buffalo burgers ,0
195,going old school...playing super mario brothers. ,0
196,Heading down to Clear Lake to meet Ken and other Coast Guar Aux for dinner.  Hope the roads are clear...not feeling up to rowing ,0
197,_power if you're truly addicted to twitter. you should link your facebook and your twitter together. update one and it does both ,0
198,  in most ways at least    at this rate though i may even bake something tonight!  who knows?!?,0
199, Thanks! I'll take inspiration from today's test. ,0
200, Hey there! ,0
201, oh good. thankyou ,0
202,Im feeling very peaceful now that my room is clean and ny hair is cut. I think Im ready for a nap. ,0
203,partying it up tonight at J lounge in downtown LA. Its a nice sunny day in cali! ,0
204," when you guys come to washington state, you should totally crush that tacoma mall  PLEASE? lol",0
205,_xoxo  seth mcfarlene is god!,0
206, I'm so glad you guys are having such a wonderful weekend. ,0
207,Goodnight all! ,0
208, are you sure bb? ,0
209, i half taught myself half actually learned viva la vida by coldplay..epic song ,0
210, hehe u are funny!  follow me ,0
211,watching NCIS. Is it the grey hair that makes Mark Harmon so attractive? I think so. ,0
212,ready for some PATRON! in Hollywood for Phathead's bday ,0
213," i have to go skydiving,  ill let you know next the time im in town ",0
214, nothing ,0
215," I have the yearbook in the closet-I'll look it up 2moro if u are still curious  -Um, where did  go to school exactly?LOL",0
216,New Osalto blog post -  Enjoy ,0
217,blasting the Across the Universe soundtrack ,0
218," oh don't worry, not gonna be too bad cos its a Sunday! ",0
219," lol so, I don't really understand Twitter quite yet! But I JUST got your reply to Chipotle. And thats cool ",0
220, All the cool people were herebeforeoprah ,0
221,i had a fun night! got to see  and andy from ! yaye! then  took me to ihop  yum!,0
222,Oliver Long getting ready to come on ,0
223, I was at the show last night!!  AMAZING!  So glad I was able to go!!  ,0
224, Yes NYC has it's own way of love/hating you...  ,0
225," BTW Meant to tell you earlier, sweet shirt, to wear Afflication/UFC shirts, still waiting on my cool card to get auth to wear ",0
226, u a learn! ,0
227,skyping is such endless fun ,0
228,Bali in july  japan!? when's a good time to go to japan? anyone?,0
229, thanks for following me back ,0
230, Nice.   I think I'll get to sleep so I'll have enough energy to enjoy my horsey day.,0
231,just joined up.  can't sleep.  mon-tue trackday at NJMP on the CBR600RR     ...thunderbolt,0
232, | thank you * huge hugs * ,0
233,  I recently did a Matrix Trilogy sitting..that was tiring but awesome (Matrix Trilogy is my favorite sci fi film story) ,0
234,_xo Totally agree with you on Beyonce. She's stupid. (: Ali Larter is WHERE IT'S AT! ,0
235," Don't forget, parents often think of their offspring as about 12 yo ",0
236," Wardrobes are often made of cheese, so you can eat them. ",0
237,went 2 wallyworld today had an awesome time getting a kewl easter basket and a nitelite for my computer ,0
238, okay! he just texted me saying that he'd wake up me up lol... if he doesnt I call you at 1PM your time! thx Karen ,0
239,? now Sleep ,0
240,Watching the IDNHU vid! ,0
241,  Can't wait!!!,0
242, happy birthday! Take plenty of pics/video so you'll remember what you did later on! ,0
243,good night tonight...my journey on twit ends here until tomorrow  see ya tomorrow,0
244, congrats you are now cooler than me.  Happy Birthday Miss Lovely.,0
245,night twittz! Jus came home from partying  loved it ..hella tired Allergic to cats ew! All irritated,0
246,Happy easter !!! Everyone ,0
247, janine whoa dude hahah u really put the things i sent u sa fb ahhaha!!gee tnx janine ,0
248, hehe yep I love car boot!!!  Never usually buy much heh ,0
249, LOve you DIDDY   Diddy live  ,0
250,"I'VE FINISHED THE 'EAT ME, DRINK ME' BADGES!!!! ----  ---- Look here ",0
251,Just about ready to go to bed. It was a long day today. Good night. ,0
252, oooh cool cool thank you very much for that information ,0
253,  I love you too,0
254, we should! We'll organise it properly next time. Glad you enjoyed it ,0
255, ... got it ... you must be rechargeable ,0
256,_blgspt thanks ,0
257,"  good stuff  Woop, looking forward to tomorrow  Have a good day Mr Brian.",0
258, Morning Irish BTW ,0
259,OMG I fixed my iPod! ,0
260,thinks you should read her real blog:   it's awesome; like me *lol*,0
261,"Congratulations, i hate you ",0
262," ?(dai)=blackish green,?(si)=silk,so?? is silk of blackish green color,i hope you like it ",0
263, ,0
264,so both sweetpea and I are back to school/university 2moro - reality bites. It's been a great break tho  feeling rejuvinated.,0
265," THANK YOU! My feet and legs are aching, but that comment eases the pain. ",0
266, i was in 2L till 3am waiting for u... kekekeke jk ,0
267,Anyone care to comment on last nights Hells Kitchen?? Well.... ,0
268,is about to build a website ,0
269,"Watching wizards of waverly place, lol lol lol ",0
270,of to sacc. meet my parents ,0
271, awww thanks for calling me sexxxy......and I thought you forgot about me... ,0
272,stared stupidly in front of my dad. HAHA. He looks like Einstein. ,0
273,Yet it's you I see wasting the dream that only I deserve I'll tear off your face to see your smile.  3,0
274,good night twitter shit lol  im fuuuucckedd hjdjjsiurjhjfhoipwplkjdhjdhhjhjdxdhueuhrjjjjjaaayyyyyyyyyyyy,0
275,I borrowed this from George  ? ,0
276,Champagne breakfast  Bubbles went straight to my head tho lol,0
277,_c Good try  Well done with the painting by the way.,0
278, welcome home ,0
279,todd = saviour. Goodnight Facebook  ,0
280,Just heard my bootleg remix of  u seek amy on kiss fm here in Chicago ,0
281,"_go AHH! vampire! haha, you ain't that pale naman ah ",0
282,On the road to my wifes 1st triathlon. If I do not update in 6 hrs. Call the paramedics. ,0
283, I can't waight  till the new albam is out  you guys saved my life you rock,0
284,feels like eating an 18' inch pizza from yellowcab. can someone give me. haha ,0
285,Happy Sunday to all! Getting ready to go to church!  I LOVE GOD SO MUCH!!!! DO U? Take care friends!!! ,0
286,_Fitz I am taking a dad with me ,0
287, I will tomorrow! my computer is off and I'm on my phone right now ,0
288, LOLOLOL i love a man in uggs. ,0
289,Ooooo... what a change! ,0
290,"Sammy, If your reading this. You are amazing. Your my Sunshine. I love you. Thanks for everything. And I bet you feel the Love now  HAHA.",0
291,"This night  It was awesome, I slept at 1 a.m . I watched Kyle XY and SUPERNATURAL , So great !",0
292,  KIM !!! how are you ? sorry for the sun burn lol.... hope your feeling good ....follow me  P-L-E-A-S-E !!  Big Fan 3,0
293,Lunch. Over. Dishwashing. Over. I'm back! ,0
294,  - omj! you look hot in every pic you're in!  I love your new haircut! ^^,0
295, F.U and your 200 more followers haha ,0
296," Ah, nevermind, it's the thought that counts.  (Also quite predictable)",0
297,last night was good  watched pearl harbour in elli's. ben afleck  whoever plays his best mate in it is fit! anth fell asleep lmao.,0
298, we got beaten... but less than they were getting beaten without me ,0
299,What a lovely night.  ,0
300,_epa umm through this arrangement what would be the earliest day  i could get them? ,0
301, i didn't make cos I was one mango short but I was to use fresh mangoes. They're in season ,0
302,"Am home with the family, wet cos of the rain, got a call from dad on the bus cos my mum got worried that i wasnt home yet isnt she sweet ",0
303," hey hun! great to see u're on twitter, too  hope u're well ;-) x",0
304, yeah right - you!?! ,0
305,"awake, lovin' arttm, ff5, the maine, and 30H!3 more than ever ",0
306, Great thank you  Have you been making music goodness today? ,0
307,"On our way 2 the airport  ... Bye, bitches!",0
308,"Longest sound check ever... So long that I have time to type this, on stage. ",0
309," well next time then, next time. ",0
310,"Anyway sarah prout we all wish you the best of luck, and hope you have fun in the process.  Cheers ",0
311, i would love to see some of your writings  i think you're a great writer for what i can judge!,0
312, Make sure you don't take the fun out of fundamentals. ,0
313,"its my birthday!!!!!!! finally 19, woohooooo!!! ",0
314,Wondering why Capcom found it necessary to comically increase Zangief's bulk throughout the Street Fighter games ,0
315,super tired... it's too early to be awake on a weekend. kings island later ,0
316,my Gosh  like sayig that its funny Gosh haha not the meening just the word its self,0
317,_carter  - okaaay  thats crazy  luv it  erm....blue?!  omg ,0
318, Thank you. When i was younger i used to hate it because i was bullied for being Ginger.. but now i love it!  x,0
319," if you won't miss a Star Trek movie, then you ARE a Trekkie just not a cross-dressing/conference going type  lmbo",0
320,my updated myspace accout  love my playlist : ,0
321, I'm already bouncing back. No meltdown. Just catching my breath ,0
322, hey  how are you?,0
323, is that what we're having for breakfast tomorrow? ,0
324, Oh I do things similar to this all the time! Thanks for giving it a name. I am researching it now. ,0
325,Happy Birthday to me! ,0
326,Spaniards can notice my Galician accent when I speak English. They find it funny ,0
327,  - Mysha  Myreen are so cute... ,0
328,Peaceful and sunny ,0
329,is going spend Sunday with my family ,0
330," lol I bet, the stations will be hearing from you alot  lets hope the single is red hot!",0
331,Or maybe our connection is just so shite that everyone beats me ,0
332,The end is nearly in sight! Thank god. Got a cheeky bit of supernatural on in the background ,0
333, Irish and German... There's the spunk mix! ,0
334," hahaha! I know, I'm so uptight.  THANK YOU, handsome!! xoxoxoxoxoxoxox",0
335,looking for boat rentals at Lake Eufaula for when family visits.  Any recommendations?,0
336,Its my birthday! ,0
337,Good Trance music  redbulls!  asot400,0
338,My first OPI: DS Desire. Preparing to try it now ,0
339, nice choice anyway.  I thought maybe you were the artist ,0
340,"Ever since I bought my Macbook, I send much more emails. It's so fucking easy, that I becoming a spammer ",0
341, welcome back to LA  Congrats on shout out!  Looking forward to your residency at HC!,0
342, yeah i wouldnt care if i was in a Disney channel movie! but i really wanna be in a horror/thriller ,0
343,"Gosh, I had not realised how much film studies work Pete had set us. Meanwhile, I'm going to watch 'The Motorcycle Diaries' ",0
344,yes! the littlest houseguest is going home today. its already turning out to be a great day ,0
345,is excited for her friend date today ,0
346,Watching NBA playoff coverage.... My favourite question: Do the Jazz have a chance against the Lakers? Everyone's answer so far: No. ,0
347, men are annoying ,0
348,spending the day with my sister ,0
349,watching football again ,0
350,Hope everyone is having a SWELL day ,0
351,"_Duncan Just need to be outside a little while to get my fix, then I'm fine with glances out window while I do the 'puter thing. ",0
352,Diggin mah new sweater ,0
353, iloveloveloveyou! ,0
354," in other words, I may just want one for myself when u finish them ",0
355,Anyone giving away an iphone lol i really want one  anyone generous =],0
356,Thank you to all of my new followers!  I appreciate you ,0
357, good luck with everything. it was great having you around ,0
358, awesome  i have one...there's some cool games on there ,0
359,Getting ready to go to a bbq at my baby daddy's house with his wife and our kidscrazy huh!   Peace..Rockin the bob marley tee and some j's,0
360,  Cant wait til you come to halifax! July 25 baby! Got my ticket! ,0
