,text,new_label
6689,_RICHARDS Very Cool Ms. Richards   Enjoy your day.,0
6690, *blushes* awww now I feel a bit fluffy towards you!!! ,0
6691,school's canceled... bummer. but its also okay. ,0
6692, True enough.  Though I don't push my luck that far at work.  ,0
6693,i cant wait till i get sims 3 its going too be amazinggg  (YN),0
6694,"On the way back home now to catch up with the F1 I have on record, then barbecue + banana beer... ",0
6695,Doing Nothing! DOMINGO! ,0
6696,Listening to The Fray ,0
6697, well. its just showing in america so its always late here ,0
6698," when you play guitar for so long, how do you stop your fingers from hurting?? or do you just put up with it??  ",0
6699,My mom's b-day ,0
6700," Bugger being sneaky. Flash on and camera in continuous, get as many shots as possible. Pap the hell of of him ",0
6701," oh the poor birdies! actually, they're prob happy-means the worms will be out! ",0
6702,Excited for Extreme Rules ... Yeahh ,0
6703,"tonight, im celebrating LOVE! ",0
6704,FROOOOOOOT!!!  Nom nom nom nummy!!    My little girl sure does love her fruit ,0
6705,tumblr is fun. but i have writer's block... so I don't post much. HAHA! claudyraz.tumblr.com  Follow me?  imma follow you too. ,0
6706," Thanks, Queenie! Omg, I am so going to buy it. It's perfect for me. ",0
6707," tom, i need you here in brazil! when you come again? i heard that you're back in october, is true?  Xx",0
6708,"So far, no 3g wireless network. I'm having to suffer on this painfully slow EDGE network  ",0
6709, I've moved school before...it's not that bad really ,0
6710,  Your Welcome..Dont Let Jealous People Get You Down..Their Just Big Dumb Losers!  Who Wish They Were As Cool As You! ,0
6711, thx Soror I will! Enjoy ur beach day ,0
6712,"@__xkul0tx__  you're wonderful  I hope that feeling never ends  Morning is good. It's early, fam sleeping, me- hungry...",0
6713,i am so tired. going for a shower then to bed..  NIGHT!  oh and its so cool that  is here in the phils. yay! haha ),0
6714,_m_doc  Morning! Heading out the door to church! I'll catch up with you all laterz!!!!  ,0
6715," I beleive it was Baccara? First time there, quite classy and good mojitos ",0
6716,       glad you guys are OK. Well done for being heroes! ,0
6717," Or  the illustrated version: Once upon a time, they lived happily ever after.  3  The End",0
6718,   Music Terminals Festiva in Taiwan!!!!  sooooo excited!!!  ,0
6719,Let's go Lakers! Hooyah! I know all the haters are gonna be annoyed with me today ,0
6720, thats a good thing  3,0
6721,I'm wondering if winter is really over now so I can take the motorcycle out of the shed? I'm starting to get the itch to ride again ,0
6722, - I don't know yet ,0
6723,just got home. . fr0m mass and hospital. . .   samson:get well so0n!,0
6724,_Michelle morning beautiful;  lmfao,0
6725, You play guitar too? Coolness! ,0
6726, Morning sir ,0
6727, - Saw my first commercial about your upcoming 'Hammertime' TV show.  I do think that you were better dancer than your young 'un ,0
6728, This was one game I loved when I was younger ,0
6729,"could really do with a lazy sunday afternoon nap, perhaps waking up to the smell of a nice roast dinner cooking... LOL ",0
6730,about to go to work.. i had the best night last night ,0
6731,going to see  today ,0
6732,"finally finished breaking dawn! SOOO GOOD! sad to see it end tho :/ gonna find some food  then get some work done, now rather than later ",0
6733,waiting to go to the fair  while listening to the miley album!,0
6734,oops... LOL  Well hopefully the party will help them forget their situation for a while ,0
6735, hi miley... The song  the storm is incredible  i love it... Congratulations ;),0
6736,: Hey me! Hey you! Hey us!   Thank you!  ) See ya real soon : Did  post the pics?,0
6737, 'morning! Have a great day today. ,0
6738,_amazingg haha dude i'm about to fill my pool with soap and just throw pat in. bring tom  haha. i love how he was SUPPOSED..,0
6739," ur an awesome source to follow for all MJ news, especially with the tour  cant wait, keep it up!!!",0
6740," Nothing, just bulb photography.  Yeah! We should go out some time! : Yes, it is neat. (?) Hahaha!",0
6741,_Nadiaon Well I'm glad you're sis persuaded you otherwise. Welcome aboard ,0
6742,Im well bored what can i do .. i aint been on here in ages ,0
6743,"is going today to the gay parade!  We're here, we're fierce, get over it. xD ",0
6744, Don't let me be your motivation. Staying fit and healthy should be motivation enough! ,0
6745,I hardly ever get to say that ,0
6746," I prefer purple. Especially when combined with golden, the two colours look awesome together ",0
6747,baking all morning. then headin over to the mieleki's for the cookout!  so excited to see everyone!,0
6748,"_Buchman Thanks for the great advice!  You're right, the workout before the cocktail is always better than vice-versa.  ",0
6749, Hey how's it going? Now you can follow me on twitter.  ,0
6750,Happy Sunday Tweeple...  Live your dreams and make every day count!!!   Continue to spread Love and Joy to others...   ,0
6751, Think of it as  many times you have ridden the earth around the sun getting older = honor - like I ridden it more than you ,0
6752,finishing off so amaziing raisin bread ,0
6753, haha thanks ,0
6754,Cleaning and getiong rid of skin on a chicken is so wrong! :/ i hate doing it!  but i love cooking though lol food is my best friend ,0
6755,"ALSO, WATCHIN WEEEEEEDS ",0
6756,listening 2 capital fm summertime ball while playing on my psp ,0
6757,Playing with helium gas filled baloons ,0
6758, Well I will see it after Changeling and The Last King of Scotland ,0
6759," I've not used skitch before, let me try again  (5)",0
6760," blue skies, bright and sunny, STILL.  wish david luck for mee. ",0
6761,Happy late morning (my time) everyone! ,0
6762,Good Day People  just pop out of bed  looking at E! news,0
6763," -  yeah  hmm.. i think so, i've never been there before but it was like 3 caravans there haha",0
6764,Doing the weekly drive by thru Mandarin soon. ,0
6765,just back from the shop with ppv munch for tonight! i feel shattered. a nice chilled sunday is in order ,0
6766,_Allen  Lol. def my kind of gardening too - reclining on couch whilst organising the activity with other people's arms and legs. ,0
6767,says pimple still hurts. but it's better thanks to 's tip  ,0
6768, Hey hunni!  Knew one day you'd eventually become socially inept! ,0
6769,m's i think soooo ,0
6770,listening to birthday sex ,0
6771," if it's just copy, and it's casual - no content - no problem. I need something to colour up the PHP cramming ",0
6772,just got a job offer! Thank god!! ,0
6773,Watching The Hand That Rocks The Cradle...psycho nannie type of movie.  justt took a nice hottt showerrrr ,0
6774,"Had a cool talk with Woody the roadie who has been hangin out and helping us out, he set up for viva la vida tour. ",0
6775," I'd love that superpower, do you think tht by some force of nature we could come to hold these powers? I hope so ",0
6776,"Why my mixed feelings? :S Ok, it's time to stop thinking  go to sleep! ",0
6777,"Hey, who laughed. ",0
6778,"  aww poor little one.  SHe prefers if you call it the princess room, pls and ty. ",0
6779, - My beautiful Molly-cat ,0
6780, I loved that movie too!  Now i want to watch it again lol. Have fun today ,0
6781,"Right, need to potter off and do some chores and tings. Everybody relax and don't let the bastards wind you up.  S'later! xx",0
6782, Yay! That was the deal of the century. And  is on Twitter. ,0
6783, Thank you  Reeeally needed that today-you're going to make me all weepy now! ILY too  xx,0
6784,"Leaving for a week at Bonnaroo in Manchester, TN. Music, art, and camping....and humidty ",0
6785, aww cool  bet your all excited  has em got a preference ? xx,0
6786,New York was wet.  Lovely but wet. It rained the whole time we were there ,0
6787,so far so good!  ,0
6788,My wifey still asleep. ,0
6789,It's really nice to know that you think we're all out of time. Going to Six Flags for the day ,0
6790, welocme ,0
6791, Sounds fancy  Think that is my cue to get my sluggish self up and head to the gym! Thanks Danny love!,0
6792,Getting some breakfast.  I'm really paying for last night  (via )i hope you didn't pay for that hat in your pic LOL WTF is it,0
6793,Bohica2k Book Of The Month-June is a fresh post at  Check out what I have my nose buried in.  ,0
6794,"Just got out of church, ready to eat some fried chicken ",0
6795,"invites everyone of you to watch me in my first ever mall gig. See you in Market! Market!, 730pm this Saturday, June 13. God bless! ",0
6796, Hey cutie! After that article I wrote about u I got offers from major mags 2do a follow-up. Means uI will have 2 hang out a lot ,0
6797,"She was awesome   Pic is misleading. She was bigger IRL. She was going tanning, not laying up eggs ",0
6798,Swing Night was great! hahaha  its my last swing night!!  :'(,0
6799, Get 100 followers a day using  Once you add everyone you are on the train or pay vip ,0
6800," well then on behalf of everyone, thank you. I look forward to reading your posts every time there's a new one ",0
6801,"_Pizza_Man my brazilian-best friend is from Rio de Janeiro,too! I'm from Latina,near Rome ",0
6802, Yeah. Its 1-0. We're away. The underdogs. Support Kenya ,0
6803,At the bubble house again ,0
6804, mommy jst want you to have a good habit  ,0
6805,got home and realized that both batman and superman need another coat of paint. oops.  that'll have to wait. art history ahoy! ,0
6806, I'm hurting too ... really lovely seeing you last night!! had a great time ,0
6807,It's my one year wedding anniversary today...the time sure has flown ,0
6808," lol thanks for ur text message, but i went to my friend's house to get a shower instead ",0
6809,drinking  me some coffee  i 3 dunkin dounuts,0
6810, ur a very nice friend u know  and ur gonna be more jealous cause im gonna get an iPhone 33333 haha. 3,0
6811, hahah i have a spiderman costume. and fruit snacks ,0
6812,@_MsWhite it will happen. Sometimes it just takes time. ,0
6813,with the best friend tonight shall be amazing ,0
6814, If your are down there... this twitter hell thing can't really be that bad ,0
6815, Thanks for letting me know. Tweeting them. Thanks bro. What will I do without you ,0
6816,is COMPLETELY CHOKED! ,0
6817,Ah! Blink 182. October 2nd. Sweeet! ,0
6818,finished first 4-mi race in 33:09. 8:19-min mile--new record.  also? came in second in my age group (30th place overall out of 100-ish),0
6819,"This lovely morning = X-Men  and earring making marathon. Fun, fun, fun. ",0
6820,bored need something to do!! But what to do i dont know ,0
6821,Going to see UP! ,0
6822, oh gosh how i love boybands!! does jason have a myspace?? i got aj and chris and todd and of course you ,0
6823,"1 September  ...We love to change things! Be prepared...Flavourz is coming,,,,Hahaha",0
6824," I have not used that yet - but if you come to my home, I can sponsor the wifi ",0
6825,on my way to kroger then to the pool.  waiting on a tea at mcdon.,0
6826, when did u become so awesome? Lol ,0
6827,I have just eaten sooo much tacos!!! Omg I canÂ´t stand...my tummy is going to kill me  Haha...guess I can only blame myself for this.,0
6828,Sushi-time! cant go wrong with that ,0
6829, welcome to the borg! ,0
6830,is listening to NAS - America. Now I remember why I liked him so much ,0
6831,Can't wait to get Sims 3!  Kenny is buying it for my birthday!  4 days!!!!!  ,0
6832,what do I want for lunch? Maybe Pancakes ,0
6833,last night was good  but very tired x,0
6834, /19/2nTSU-mFWGs cutest song ever ,0
6835,Cats and Dogs FTW (Y) The dogs are soooo cute ,0
6836,is making a pot of tea ,0
6837, Lol!!!! Ur too funny Mr Hottie Way  - Ethan probably went back to sleep.,0
6838,When I watch icarly/the suite life/ SonnyWithaChance/HannahMontana/ WizardsofWaverlyPlace it just makes me want to be an actor even more! ,0
6839,"_r Hey, welcome back. ",0
6840,"yesterday was so fun, now getting all dressed up to go to mall for the 3rd time this week ",0
6841,is looking forward to Reggae Wednesdays @ Churchill's resuming... June 17th no cover.  Be there ...whether or not square ,0
6842, mm...and the money is good ,0
6843,is homeward bound ,0
6844," lols yes, dollhouse is good in my opinion ",0
6845, I know! already looking online to see what I'm after! Lol! ,0
6846," would have loved that - too drunk for cake afterwards, though ",0
6847,Finished designing a crochet baby bag/blanket set. Setting up elderly crochet now. Wonder if I could do this for a job? ,0
6848,Band practice- see you later ,0
6849,is on a secret mission......  sshh  don't tell the kids    ,0
6850,is so excited about my new website coming soon. I'll let you know as soon as it's ready. ,0
6851,love the tshirts  thanks fab!!!,0
6852," hah, I wish I had the luxury ",0
6853,whuddddup twittttter ,0
6854,Ughhh so over nightmares - So Instead of sleeping tonight I'm listening to Hollywood Undead and Dj Cammy + Hanging pictures on my walls ,0
6855,The Hills then missing House for the local Pub Quiz... Team Name: Norfolk N Chance ,0
6856,i like messing with my bf and saying things like i can watch him play footie for hours but he cant shop with me ,0
6857, Red has always worked for me!!! ,0
6858, actually at least it will be cool. We did a hike yesterday and it felt good to have a little shade ,0
6859,", you guys are amazing.  i love the music.",0
6860,"im going to be really english and talk about the weather, its absolutely pissing it down here. i like it when its like this ",0
6861,aint just about talkin... i do the walkin... copped my tickets!! where's yours at?? lets go guys!!!!!! ,0
6862,Watchin a Film ,0
6863, No what was she like? Errmm its bluee + quite short  whats yourrs like? =],0
6864, I thought I was sunburnt..well I was but luckily it went away today and it's now a tan! woo! ,0
6865,Done w the pool...got some of my color bac...but ill be workin on that more next week  chillin for a lil then hittin up the gym! Day 3,0
6866,18 today!!!Thanks to everyooonneee i love you guys! ,0
6867, come back to Dallas ,0
6868,Spa day w/ mi madre  texas in T-2 days  a wakeup!,0
6869," Hello Mark, I quite like the name tweetstyle  tlifestyle Carolyn",0
6870,_MAD Ooohh yeah I knew about that  (about Emily Wilding Davison haha),0
6871,"It's almost time to get EXTREEEEEME... who wants to come over for chicken wings, pizza  the PPV on the big screen? ",0
6872,Winding down this evening after a REALLY BUSY morning. ,0
6873,Just had a quick shower......feel all refreshed lol ,0
6874,going to davidds with the sisser and the amazing amanda ,0
6875, Yes we did thank u ,0
6876, i can hide in your suitcase ,0
6877, It's quite cool.... and very easy.  Just visit.  for more info.  ,0
6878, psssssst. can you advertise my westonbirt ticket? Â£20 i just want to get rid of it. ,0
6879, NOOO you listen! its J-A-Z-E-L JAAZEEL    got thtt? xD iluusm,0
6880, its so good and so nice ;) haha that i will  hope you're having an awesome day!,0
6881," Haha, we know - thanks James ",0
6882, I cant wait for Guilty Pleasure  wbu ? x,0
6883, - that's me! - a photo to win a violet guitar signed by . had to take a rock pic!  Not the best!,0
6884, i agree  it will sort it's self out in the end  dress yet?? lol. i'm going out with my mom friday to look ,0
6885,"mama mia, here I go again, my my how can i resist you. mama mia, does it show again, my my just how much I've missed you ",0
6886, heyy  hows you?,0
6887, I say yes! Parking sucks and food is over rated. Order pizza ,0
6888,2 DAYS LEFT!! All u gotta do is clik here  and RATE MY VIDEO!! Help me meet Ciara!!    (Headed to a writing session...),0
6889,Did  just say he drives down the freeway with his knee while tweeting? ,0
6890, i miss you more than life. -.- so erm.. when are you free? ,0
6891, perhaps watching in polish took away from the experience? ,0
6892,i've now fallen in love with true blood. thanks to . ,0
6893, it would be very nice and important for me when your answer my question (backroundsinger) ,0
6894,"Is thanking @_aMaZiNg_ for opening her eyes.  I won't be left singing Sooner than Later, I'll leave it all behind for Mr. Right ",0
6895,just explained Twitter to her Mom ,0
6896," It is a bit of both. Got some clothes, shoes, a new watch, was a good day! The trains were even on time!! ",0
6897, - Oh ok! Well im still going!! I think everybdy wants Misha back! He was so funny in his talks!! ,0
6898,"  jus wait 2 days,  will surely respond to all. And me too, for advocating her ",0
6899,i lost a subscriber. just ONE! but still. ah well 36 most viewed today. THE APPRENTICE FINAL IS RIGHT NOW! GO KATE!! ,0
6900,  hes HILAR' ,0
6901, i'm crazy for new cd! this is perfect! brazil love you very very much men!  jonasinbrasil,0
6902," omg, you guys were AMAZING at music live ! best band there in my opinion , heres another person who'll be buying your album ",0
6903,goodnight twitters! ,0
6904, 2012 is the end of the world. ,0
6905, he SOO fucking sexxyyy  (he's not doing bettter without you us ,0
6906," ahahahah yeah, if you work @ one of the places that offers the tourism challenge, you can do it ",0
6907," Oh, no! How will we survive without your mad ramblings and intresting facts ",0
6908, Have fun!!  That's a beautiful area! ,0
6909,"Strawberry slush, 2 fast 2 furious w/ Daniel (some sweet cars)  Evo9 3",0
6910, you have a Ducati? Those are sexy bikes. ,0
6911,Hooooray!  just made me breakfast  Now time for star wars revenge of the sith ,0
6912," oh man, chuck!!! yes!!!! its the greatest show on earth!! i love it!! haha, well, its good ",0
6913,"thank you to everyone whose following me, once i get to a PC ill follow u ",0
6914,_09 lool nah dw trustt me lol its at 10 ,0
6915, thanks it was so good lol  me and my best friend were singing the whole time we even got up and started dancing aha,0
6916, 4 a movie? Jeans for sure! ,0
6917, fun! I'm really tired and sore from rehearsal but I had a great time ,0
6918,especially for .  hi!    â™« ,0
6919, I am enjoying a ridiculously warm day in New York... With some close friends and some Coronas. Cheers ,0
6920,"Yasmina's chocolates were awful, but she's a bloody good apprentice ",0
6921,Oh by the ways... Hangover is pretty funny ,0
6922, how about a microwave?that's about as random as it gets (joke) ,0
6923,Had a GREAT night last night  I just ate a sandwich and I don't feel so sick and I'm about to go over to johns house for a little,0
6924,is tired but cba to sleep ,0
6925, why not 3 instead?  you need choices according to time/event of the day haha,0
6926,I'm going to swim again.  Be right back.  ,0
6927,FINALLY got my heels for grad.  ,0
6928,long naps make me happy ,0
6929," and with a chocolate taste, no? ",0
6930,PAHA!  I've been having fun today. ;)  Apart from my feet which are cold and hurt   What cool... ,0
6931, what isnt it people with a peg leg and a parrot on their shoulder ,0
6932,Curtis Jest always knows what to say when it comes to mysteries such as love. ,0
6933,i JUST deleted a bunch of people off my myspace. im feelin very accomplished rt now haha...time to eat something ,0
6934, same updates as on website.lol ,0
6935, what is your opinion of best Japanese food with decent price in Springfield? ,0
6936,more bits from the email: You are one of about 10 picked from thousands of entries- so you better be good ,0
6937,so this lady just asked brad where i got my purse! and he answered!!! lol i didnt hear her ask... funny!! ,0
6938,"good night twitter, shopping trip possibly tomorrow ",0
6939,Just ate a yummy chocolate bar I'm missing my baby can't wait till he gets home ,0
6940, ...in Sweden that is.  I am as usual to tired for twitter.,0
6941,Listening to Bjork  hell yes!,0
6942, Excellent!  Most balloon animals are evil anyway... ,0
6943, Awesome background! ,0
6944,indo pras festas   CLASS OF 2009  I LOVE YOU,0
6945,Goodnight Twitland! ,0
6946,Recording sessions are the shit!  hopefully some demos soon...,0
6947, the Sandlot!!! Epic! Miss you bestie ,0
6948, why limit your story to 140 ch. Tell all what is annoying you at  ,0
6949," fuck, I hate it when you are right. Yeah, nine to six. In my defense, I was also peeing when I posted that. ",0
6950, I like the way it wrks ,0
6951," I just read your excerpt, and I REALLY can't wait for your book to come out! It's AMAZING! I'm joining the email list ",0
6952,oh thats kewl tb im just watching tv  ,0
6953," Yea, ok, the whole fat amercian thing was a bit pants but Walle himself is a cutie pie. Miss ya ",0
6954,Truck. Music. Ice cream. Nostalgia. ,0
6955,_Shellow ooo oo or they can drink a cup of bleach ,0
6956,So excited for Tuesday ,0
6957, yess i was with him XD  smartie ,0
6958,I'm thinking burgers on the grill tonight.  ,0
6959, I like this one the best! ,0
6960, How is the health these days ? ,0
6961,Holy shit! I saw a tornado today  I got some SWEET pictures of it from the roof. I've always wanted to see a tornado. It was awesome! ,0
6962,"_Crew hey there. Sounds like you guys had a good time bathing the pups. Hope the beers were good, as well. ",0
6963, Found you through . Looking forward to your inspiration.  ,0
6964,new iphone tomorrow?  Can't wait...,0
6965," that's so cool!  Go Jewel!  Have always loved your style.   Saw you in Clearwater Beach, Florida back in 1996!",0
6966,Woot woot!! Haha gonna go to the movies again I'll be on my uncles iPhone ,0
6967,video live! wait for better quality though  enjoy,0
6968," i'm sorry - dint mean it  hey i watched palindromes today... i LOVED it, so thanks a million.. very very weird though",0
6969,"just woke up; having a great long weekend, gotta do some h/w today though. but, then i'm going laser skirmish ",0
6970," Well, i compromised and went with a Team Cullen t-shirt ",0
6971, Told ya. ,0
6972, you so loved it ROFLOLHAHA. tragic  xx today is a good day for us!,0
6973, see it. WAYYYY Worth the money ,0
6974,aww loved bacc now at miz's house for the BBQ ,0
6975,The Hangover!!  movie popcorn of course ,0
6976," Oh, just a friend. lol. ;) the same one I referred to last time we talked. ",0
6977, we interior designs just know everything  from one to another.,0
6978,"3OH!3 were amazing. Then The Veronicas were up. I don't remember their performance, I was busy hyperventilating. Fml. ",0
6979,Got four good jumps in today - not bad! Top speed for the day: 175mph ,0
6980, is gone so im having a party at her house. ,0
6981, well the conference is 9pm so thats 5 here  will try my best to keep u informed hehe,0
6982,enjoying view of ocean from my room in Grand Cayman!!! ,0
6983," u're amazing *-* here in Brazil is expensive, but i love ",0
6984, Salinger needs to take a deep breathe and realize fanfiction is a fact of life  I know. Trust me ;),0
6985, My pleasure! ,0
6986," - Chloe, my sister's new puppy ",0
6987,_Chris I just mean I had a few too many  o my head.,0
6988, I know. I just don't like packing ,0
6989," Pesky world getting in the way of my idealism. I might kick the world's ass tomorrow and sort it out. First, bedtime ",0
6990,i 3 swings...   i feel like a 5 year old...  ,0
6991, i'm so happy you answered!! Can't blip now b/c I'm camping!! I really miss it! I'll blip tomorrow again  Obrigada btw!,0
6992,"_club Tell us what it is, Ya never know... ",0
6993, well i'm going again in early july minus my mother. get jaime to drive ya'll up here,0
6994,"Time for bed now I think, looking forward to my long lie tomorrow, then spending the day with  ",0
6995,musicmonday!!! I can officially shamelessly advertise  again!!! go to it... you know you want to ,0
6996,Watching The Holiday ,0
6997,going to the hangover ,0
6998,Made it to the apartment. Good to see Lindy again. ,0
6999, Call it the Kool Word! Or The Kool shall inherit the earth. Or The Kool Kid says. Of maybe The State of Kool. Just some ideas. ,0
7000," No, you didn't.  I have them on my nightstand. You're lucky I'm lazy.",0
7001," Oh, thanks ",0
7002, another all time classic  â™« ,0
7003,I need to spend the night at your house paul ,0
7004,I think this documentary should be watched at least once a year and shared with as many friends as possible...  ,0
7005, please would you follow  it would mean the world to him pretty please hes also in a band called mcfly  xxxxx,0
7006,"had super duper fun last night. swervin off that vodka, ate pizza. went swimming on the rooftop today. ",0
7007,i'm pretty sure it's 5pm assuming all goes as planned. now 5pm our time would mean no maryland that night. hotel in seattle for atl. ,0
7008,I think we have cute mormon boys..just those two though.  [23],0
7009,Did you guys like the video? ,0
7010,I see tonight is the night of drama.  please keep coming with it haters im loving it.,0
7011,going out to eat dinner ,0
7012, Done  Lets show everyone that there's good still in ol Blighty,0
7013, - My favorite puppy Panda with his eyes open! ,0
7014,"trying to find a binder to put my finished project in  eep, i'm so happy",0
7015,Bout 2 fix more nachos and punch 4 da game. ,0
7016,Watching a movie. Chillin. ,0
7017,"I'm becoming a major fan of saltwater pools!!!  After I'm done swimming, I still smell like the ocean!  Oh the discoveries of summer  ",0
7018,2 miles from my house  I can hear my couch calling my name...  Im'a comin' ,0
7019,Back in Greenville. Going to passout for a few days. So happy to be back!! ,0
7020,-- bout to do my hair. let the buring of the fingers commence! ,0
7021,regular katsu and spam musibi  gettin fat.,0
7022, Thanx  dats our newest song i appreciate u listen 2 it 4 me 2,0
7023,one of the perks of working ridiculous hours? my coworker is a model ,0
7024,at home depot feeling very very manly    ............in the garden section near the flowers      ,0
7025,I am realizing I should start updating this more. ,0
7026,Awesome football stadium ,0
7027," It's a good movie, I like that one. Never seen it start-to-finish but it's good. ",0
