,text,new_label
8949,"_OTU LOLOLOL your mom has good theories XDDD. I hope you can manage/overcome your depression! We don't have much privilege to let depression consumes us, but work it slowly at your own pace :D",1
8950,"  Thank you for enliving a troubled and  ravaged mind, even I am having one like it..I should say I am never been stigmatized, but i have been fighting with depression for the past so many years, which is at its nadir now, thanks TrishaS for all your inputs, debates.",1
8951, Depression strikes again,1
8952,depression is so weird because when you experience a good feeling it's also SO STRONG and it gets overwhelming,1
8953,"it's rainy and I love rain but rain like,,, triggers my depression so I feel like shit rn",1
8954,"Proceeds from May 12 Dreambuilders Ball support innovations at , like Volunteer Companion Program. In this donor-funded program, volunteers visit patients, listen and show compassion to combat loneliness and depression for admitted patients.   ",1
8955,Could 'one puff' of cannabis ease depression? - Medical News Today   â¦,1
8956,"I don't understand, just because someone did self analysis and decided to preach positivity and consciousness suffers from depression? Smh<Emoji: Smirking face>   â¦",1
8957,"Did You Know? 1 in 4 children between 13-18 suffer from anxiety, as reported by the Anxiety and Depression Association of America.  pic.twitter.com/YqYNg3WTiZ",1
8958,"agreed. i was bullied relentlessly after i came out to the point i had to leave my secondary school to be home schooled. i developed panic attacks, clinical depression, severe anxiety disorder, etc. things need to change.   â¦",1
8959," You've probably already decided what you're going to do, but I'm not sure this person actually understands how hard depression is because they are trying to make you feel bad for not wishing them a happy birthday, so... But anyway we are always here for you<Emoji: Heavy red heart><Emoji: Heavy red heart>xx",1
8960, got a lot of thoughts in my head right now depression is hitting me hard right now but I'm hanging in there love you man,1
8961," It's not an opinion you fool but facts, he deals with an addiction on the daily along with bi polar disorder with panic, anxiety, & depression. Have some sympathy.",1
8962," Birth control, which by the way has a onslaught of horrible side effects, one of which is depression.",1
8963,"Did you know Sour Sop leaves have many healthbenefits including treating fever, infections, depression, and many more! Use coupon SAVE10 at checkout to save an additional 10%! Don't forget FREE SHIPPING over $25.00!    ",1
8964," You , fighting your depression  pic.twitter.com/QNMSDRoDqr",1
8965,My mother put me in this world knowing that life is hard n jinks I blame that bitch for all my depression,1
8966,"dp has spearheaded a huge initiative to spread awareness about mental health. talking about her OWN depression helps in erasing the stigma associated w/depression. but yeah, bitter aish fans, aish's achievements are being duplicated by dp & pc. i get that yall are threatened.   â¦",1
8967,And the Great Depression,1
8968, Aaaaayyyyy momma you trynna take a depression nap later,1
8969,"Big shoutout to depression and anxiety for being there when no one was :,)",1
8970,"Post-Book Depression, Book Withdrawal or whateva' ya' call it. <Emoji: Loudly crying face>",1
8971,"Being outside can improve memory, fight depression, and lower blood pressure â here are 12 science-backed reasons to spend more time outdoors    pic.twitter.com/ZFTdxskBB9",1
8972,"I consider myself to be a very strong minded individual. I've gone to my lowest point & idk how others would Handle it. I would hate for ppl to go through depression, anxiety or any other mental issue alone",1
8973,"@_mallory_king Well, he's an idiot. He doesn't see the real you like I do. I see a great smile, a winning personality, and a shining heart--and a female engineer to boot. Yes, you are frazzled with depression, but peel back the onion, and there is nothing to laugh at. Just beauty inside & out.",1
8974,Can changes in your diet cure your depression?     ,1
8975,Could 'one puff' of cannabis easeÂ depression?   â¦ pic.twitter.com/z185URGHU9,1
8976,Kudos to Michael Phelps for breaking the stigma around talking about depression & suicide:   â¦,1
8977,Could 'one puff' of cannabis easeÂ depression?   â¦ pic.twitter.com/hxAsdjG5mm,1
8978,Could 'one puff' of cannabis easeÂ depression?   â¦ pic.twitter.com/o1v7mKNPkL,1
8979,I can go to the mental institution to get my diploma under depression minds. LOL.,1
8980,I added a video to a  playlist    Her last words (depression based),1
8981,me: i'm gonna clean my room so i can feel better about myselfme: haphazardly shoves all the clothes from my Depression Chairâ¢ into the drawers,1
8982,nothing like your crippling anxiety and depression building til you cry in front of your instructor,1
8983,"Spreading awareness about depression and sharing her own struggle with it is one of the reasons why she was included on the list, obviously she's going to continue talking about so ignorant people like you stop seeing it as a joke!",1
8984,  So awesome to see this happening in India finally ... I know exactly how it feels ...As I have been struggling with depression for 18yrs now ( & continue to) ...So it is frustrating when family & friends don't get it that watching a funny movie will get me out of depression <Emoji: Neutral face>,1
8985,fight your depression with productivity.,1
8986,DEPRESSION IS REAL & IDNT WANNA BE HERE !,1
8987,"Depression, mental illness, is NOT a stigma. Taking medication to fix it is NOT a stigma. Some people need it. Don't be afraid to try it, to try something. You deserve to be the real you, just like I do. I'm still trying to figure out who I am now. I'm excited to do it. (22/23)",1
8988, Is there anything that isn't just outright fraud in this country anymore? The generation that survived the depression and defeated fascism are so proud I'm sure...,1
8989, Weed helps my depression tho <Emoji: Man shrugging (medium skin tone)>,1
8990,"I let this depression and anxiety rule me. I let it affect my writing, pushing me into a corner blaming everything and everyone one for my failure, my lack of progress and work,  except the one thing that was really causing it: me. It was too much for too long. So I spoke (16/23)",1
8991,"I like the idea of college in theory. Other than the shit grades, depression, debt, and competitiveness shit's lit.",1
8992,We <Emoji: Heavy red heart>Boris gentlegiant hopecharityproject <Emoji: Raised hand with fingers splayed (medium light skin tone)><Emoji: Heavy red heart><Emoji: Rainbow><Emoji: Dragon>holdonpainends depression anxietyâ¦   ,1
8993, This is why I have depression <Emoji: Pouting face>,1
8994,why hasn't the depression groan been added to the diagnostic criteria i mean 24/7 i'm justughuGHuuuughhhhhhhhhhhUUUUUUUUGHuuuuuuuUUUUUUUUuuuugH,1
8995,"THREAD A few months ago, I took steps to address my mental health. I think I've known for a long time that I've had anxiety and depression issues I just chose to ignore them, to lean into them, to just turn my nose up at them like I was superior somehow. I wasn't, I'm not. (1/23)",1
8996,"A video of my new invention, 20 TwenTea:cancer, diabetes, dementia, depression, brain, heart, liver disease, eyesight.  ",1
8997, I am really really reallyyyyy scared that i'm going to have postpartum. I hope not tho. At least me being paranoid about it means I won't be in denial and will get help if depression hits.,1
8998,Try to keep up with social activities even if you don't feel like it. It'll help with depression,1
8999, I had a falling out with a shipping partner because they pulled me into a depression by constantly saying I was leaving them or they wanted to delete so I dropped them. I flipped he account I shipped with them on and they got someone to make the same character toâ>,1
9000,Anxiety so real and depression too <Emoji: Face with cold sweat>,1
9001,Falling into a depression and it's so easy to do.keepingthefaith,1
9002,Please support this important event. MentalHealth Depression SuicideMentalHealthAwareness  â¦,1
9003,Cures depression :)  pic.twitter.com/ZO9c1hgS73,1
9004,Transparent moment: I sometimes go through spurts to where I struggle to feel any emotion. I oftentimes have to make a conscious effort to feel emotion when I think they should be happening naturally. I read somewhere that this could be a symptom of depression...,1
9005,Shoutout to depression naps lol,1
9006,"Like I'm all fun here and talking about ships, sometimes opening up about depression, but generally here I'm silly, joke around, or talking about not so serious and maybe childish matters; but that's the way of me relieving my stress, that is not me, real me is too complicated",1
9007, is a senior correspondent  and a member of their peer support network mentalhealth journalism trauma depression   â¦,1
9008,"My mom died last week. I don't have any relatives. I'm alone and it is so hard. Today is the first day without anxiety and depression. I wanna live, I will not give up, I will fight like my mother did.",1
9009,"Isolation, Depression & Being An Entrepreneur by Phil Hayes-St Clair   â¦ Startup Life LifeLessons Entrepreneurship SelfImprovement",1
9010,Journey2worthy podcast episode 13FLAT to FIT! Listen to  as she explians how to overcame a severe depression and started her own fitness company! Tune in here:    pic.twitter.com/SaXILDoiBq,1
9011,I watched the Jurassic Park Trilogy and now I am nostalgic and optimistic too. Come at me @ depression.,1
9012,DEPRESSION MY NEW OBSESSION,1
9013,"You could laugh at her clothes, PR, and her boring interviews but don't you dare question her depression bitch.",1
9014,I've been fighting severe depression and extreme anxiety for about 5-6 years now and anyone close to me knows the lengths I've went to escape it. While I'm still fighting I will say I feel myself coming out On The winning end and a lot of that has to do with those around me <Emoji: Heavy red heart>,1
9015,"JUST STOP. Dopamine is for mood elevation. Norepinehrine has activity on both @ and B receptors, increases sympathetic activity. Serotonin levels decreased in anxiety & depression while oxytocin causes uterine smooth muscle contraction in active phase of labour. Period.   â¦",1
9016,my dad rly sent this to me... depression culture  pic.twitter.com/Sdl2Tw5bPW,1
9017,yes depression has won this round yet again  pic.twitter.com/OiqLyGpwbw,1
9018,Post concert depression is so freakin real,1
9019, Are you anhedonic from depression?,1
9020, Love this i am gonna watch it 24/7 i won't have social life i will have newt depression hours only,1
9021,"I'm depressed , depression always attacks me , I don't feel ok everyday, I'm just fighting over my depression, i was not supposed to be happy today , people now a days doesn't care about how people feels",1
9022," not gonna front when that nighttime depression kicks in and i see that ur going live it just brings out the happiness in me, that's y i'm such a fan of u",1
9023," It's a prescribed medication for her depression. Granted, it was illegal in SK but, she was not selling it unlike others. She's been humiliated & unable to work. What more do you want? Why do you keep kicking someone who's already down? Leave her alone!!! ë°ë´ì ë°ë´ë²ë ¤ëì¸ì",1
9024,Just got a big wave of depression at work and I have a date with a girl tonight. prayforme <Emoji: Face with cold sweat><Emoji: Person with folded hands (light skin tone)>,1
9025,depression is slowly crippling me seems only days I leave the house is when I work otherwise im in bed,1
9026,I've decided to battle depression with physical fitness.,1
9027,   Humans need reassurance in times of stress or depression. These makes them very easy to be influenced by these godman or priests who exploit the vulnerability. Most problems do go anyway or you get used to them. The godman take credit for this and gain disciples or devotees.,1
9028,Nice to see this finally happen in India! I remember the time when Deepika sat down for an interview to share with the world her struggle with ' Depression 'It is so imp for celebrities to share it if they are struggling with it as it makes them ' human' too !   â¦,1
9029,"So next time, y'all think Deepika Padukone 'uses' her depression struggle as a sympathy gainer- take that opinion of yours and throw it in the trash. She shares it because people like you are so fucking ignorant about something she and 1 out of 5 people face on a daily basis. (3)",1
9030,Coachella depression isn't real when you went your hardest all weekend.. I was begging for my bed and a shower after this year lmaooo,1
9031,   it's not depression it's anxiety and i will let her know <Emoji: Face with tears of joy>,1
9032,"Apparently I'm in a state of moderate depression, what a good day to be alive !  pic.twitter.com/WqovF9Diil",1
9033,"@_celia_bedelia_  Hear hear!  I've lived with mental illness (depression and anxiety) for decades and I have been unintentionally celibate too (my issue, not women's) and I have never felt the need to kill over it.These men are not normal, that is true. But I'm tired of armchair psych evals.",1
9034,2018-04-25,1
9035,Let's talk Depression during pregnancy and what to do about it.    pic.twitter.com/tk8gYq9V0c,1
9036,im gnna go to sleep i have depression i love my friends and nct and wonwoo,1
9037,HOLD THIS PHAT L DEPRESSION   â¦,1
9038,Our great war is a spiritual war. Our great depression.. is OUR LIVES..,1
9039,Depression always leads to more depression and realizing it leads to even more depression.,1
9040,"_AO3  _CAPS I told cwb this, in the worst of her depression. There is something so amazing about her joy and love for other authors and artists. I never want it to change.",1
9041,"Trump is screwing up every part of our financial systems, and sooner or later he's going to end up sending us into a depression, just as happened back in the 1930s. The man needs to read a book on history and economics! <Emoji: Pouting face><Emoji: Pouting face><Emoji: Pouting face>  â¦",1
9042,Tbt this song that helped me to deal with my depression  pic.twitter.com/C1PCXyeM51,1
9043,AgoraphobiaDepressionPTSDAnxietySickNotWeakI have had a couple of good days since med change. Getting more bold about going out! I hope me & doc have finally found me a little happiness!<Emoji: Smiling face with smiling eyes> pic.twitter.com/pgR4BAYSIx,1
9044,my depression & anxiety creeping up on me  pic.twitter.com/Uxwjl0wUY2,1
9045,depression is hunting me<Emoji: Tired face>,1
9046, the depression on the truck is <Emoji: Fire>,1
9047, I'm in a constant state of depression,1
9048,"Pulitzer Prize winner  Talks About His Depression and Suicidal Thoughts, and Music as Therapy,  -     mentalhealth via ",1
9049,im sorry but that's truly just not the case at all. mental health is different for every person but if you do your damn research you would know that homicidal tendencies do not relate to depression in any way,1
9050,"it has been 4 years... 4 yearsof harassment and hatred towards a woman who wanted to take medication for her depression. just leave her alone, please. ë°ë´ì ë°ë´ë²ë ¤ëì¸ì",1
9051, Not when you suffer with depression  pic.twitter.com/jXfGCxyjxr,1
9052,"Depression may be prevented with daily exercise, says new study    via ",1
9053,"everytime we talk about depression in psychology,""  gives me the side eye like """"i know a depressed bitch here rn"""" and i scream each time",1
9054,6 Things to Know About Childhood Depression â U.S. News & World Report -   â¦,1
9055,"2 National headlining Acts Next month..I wish I could go tell my 7th grade self that all the bullying, the sleepless nights the depression etc.  was all worth it and that it gets easier and the growth has been incredible My life is a fucking blessing but NOTHING comes overnight  pic.twitter.com/IA8NYOAQ4c",1
9056,"We finally spoke about my depression and besides not believing in this whole disorder, she gave me her blessing to go ahead and admit myself at a hospital<Emoji: Loudly crying face><Emoji: Loudly crying face><Emoji: Loudly crying face><Emoji: Loudly crying face><Emoji: Loudly crying face>",1
9057,All this depression is no joke.. I'm breaking out so bad <Emoji: Disappointed face>,1
9058, Lots of depression in this thread.,1
9059,"Me: New job, good pay, bills coming down, got health insurance, new friends, going out more, having fun... life's better!Depression:  pic.twitter.com/8mKP8APsRF",1
9060,  These snowflakes would NOT have survived the Great Depression or WWII!!  pic.twitter.com/yPbLtfQYgS,1
9061,  Oh wow. I owe you (and your colleagues) a lot. There's some weeks where my depression and/or anxiety make it impossible to do actual interaction with the world in person. Without the internet (which makes Twitter and email possible) I would have no way to at least let peopleâ¦,1
9062, sadly not as deep as i thought. But I think It's farely difficult to describe paralyzing depression and the struggle to stand up for your rights.,1
9063,"ah i just had a vision, i saw a 14 hr depression nap coming my way",1
9064,"Oh ok, i see how it is. Period and depression are just gonna double team me cuz i'm a little bitch and can't stand minor failures that i know better on. Like letting food expire before cooking it.I see how it is, thx. Love it.",1
9065,"Depression, BPD, anxiety suck with no where to vent.  Ugh",1
9066,"i always try to spread positivity but i don't do it enough on twitter. <Emoji: Frowning face> but to let you all know, im here if you need anything. i've been through depression, anxiety, suicidal thoughts, attempts, being curious about my gender/sexuality. i'll do my best to help <33",1
9067,"  Pulitzer Prize winner  Talks About His Depression and Suicidal Thoughts, and Music as Therapy    via  mentalhealth",1
9068,"_sport          Kalena,I am so sorry u had a stroke!I have had several TIAs without lasting disabilities,Thank God. Being a retired RN I understand just how close we both are n having life threatening events.Don't give up hope & don't give in to depression, it can cloud ur perception,Wish u Best",1
9069, yesssssssss cure my depression with a video  pic.twitter.com/uwWtUs1kV4,1
9070,"Shame and uncertainty are only a few short steps away from depression and anxiety. Separately or together, those emotions can drive you to the brink. They can blot out everything else in your life and literally make you crazy. -Lewis Howes",1
9071,: Treating Depression With Functional Medicine (  )Depression MentalHealth FunctionalMedicine pic.twitter.com/q2F1xUnD8B,1
9072,Just one puff of cannabis found to reduce depression Read More:    pic.twitter.com/ufvAE5zyvO,1
9073,"From there, I tried to have regular conversations again. He has depression, and he's not open about anything. He's also moody around me, mostly because I'm such a terrible friend. Eventually, that wretched, terrible side of me took over. It decided that it had enough of it.",1
9074,Twitter has become a place where I'm able to write about my struggles with anxiety and depression. I also see that I'm not alone.,1
9075,Depression isn't even real dude lit up lmao,1
9076,_afzaal Its not depression if you're like this since YOU ARRIVED IN THIS WORLD.,1
9077,Depression and drug addiction dont blend in,1
9078,I can't sleep I can't eat properly I'm always sadI want to dieWelcome to depression,1
9079,Korea is the most hypocritical country. They cry the death of someone who died of depression but they harass a woman who tried to cure her depression. I cannot. protectparkbom1115 pic.twitter.com/q4QxKLAkn7,1
9080," As someone who uses photography to cope with anxiety and depression, and a fan of Watts as well, I recommend this book also!  pic.twitter.com/J6gKrDhSXe",1
9081,   _G_Media  Trust me I know. I know very very well what depression and anxiety feel like.,1
9082,"My life is just one long anxiety attack strewn with depression, etc so bad you cannot un-dwell",1
9083,"It took me two hours to go grocery shopping and I have no energy left to drive home, so I live at Publix now, I guess. depression",1
9084,13 days* depression is hitting so hard that I'm getting dumb,1
9085,i cooked. depression where?,1
9086,Using drugs to avoid depression,1
9087,how to remove somebody else's depression and anxiety. help <Emoji: Pensive face>,1
9088,Did you know there is more than one type of Depression? Take a Read and Share the Blog to Raise Awareness!   â¦,1
9089,"Me: I have depression and panic attackPeople: get over itMe: *suicide*People: omg poor little girl, what happened to her that made her to end her life like thisPeople dont care bout u when u r alive, they only care bout u when they get news bout uIt's true when they said..  pic.twitter.com/bVRXuHWKp6",1
9090, He's an extremely emotional person. I would honestly rather he sank into depression than go this way,1
9091,Ask HN: Effective methods to fight depression?   ,1
9092, That 98% tax for working class is what was talked about to cover Bernie's big ideas during the election. Think that's not possible - FDR did it during the depression - If you want to see what would be result of this plan - search Venezuela economic crisis,1
9093,"Sleeping next to someone you love not only reduces depression, but it also helps you to live longer and makes you fall asleep faster.",1
9094,I'm miserable but not the type that wants company I'm the type that what's to be left alone. Maybe that's depression.,1
9095,"  scratch, worry is marketed as manic depression because people cut down a trees without asking first. 2 Chronicles 16, I went on a field trip to lake fennwick in H.S. and some peers climbed onto your lot. Me, walking the board walk looking for a bed to fish",1
9096,Depression is such a villainous state,1
9097,   _depression Not really. Actually poor ad hominem to try and discredit one's stance because they share thoughts and opinions outside of their realms.,1
9098,I love a good depression nap,1
9099,My mom told me about her depression and how she started cutting again so I told her about some of my issues ( not my ed) and she told me I'm hypersensitive,1
9100,My mother is the biggest part of my depression and all she does is push me everyday closer and closer to the edge <Emoji: Unamused face>,1
9101," Higher Rates of Depression in Sexual Minority Youth. Adolescents who are gay, lesbian, bisexual, or are questioning their sexual orientation have significantly more depressive symptoms than their heterosexual counterparts, new research shows   â¦ via ",1
9102,Topic 3/4: Mental Health and Substance Use. Paired topics due to sequelae. Text focused on anxiety and depression. States that anxiety is a given consequence of gay-related victimization. Gay and bisexual men experience higher levels of psychological stress,1
9103,I mean I think I'm just being funny but apparently my social media is a slight cause for concern and may cause depression in previously mentally stable viewers??? Eh soz and opps x,1
9104,"Early bird, but depression turned me into an unwilling night owl and it's the worst.   â¦",1
9105,its post iw depression hours,1
9106,Depression is my drug of choice because I get to experience all of the lows without having to go through any of the highs!,1
9107,Study identifies new method to treat bipolar depression  â¦ pic.twitter.com/9zIdAKEZjW,1
9108,  _Chubb Obama got the US out of a severe recession/depression that Bush got us into. That's a fact that you can't change with your typical MAGAt cheeky remark.,1
9109,"A million memes a day,keep depression away.",1
9110,Sonic Mania Plus cured my depression,1
9111,Worst thing about depression is forgetting to eat and then losing weight and getting migraines.,1
9112,_Myth _eh_go Its not just depression. It's accepted cuz everyone likes the feeling it gives you.,1
9113, I have crippling depression *road chair*,1
9114," That's absolutely not true, and you really shouldn't talk like that about yourself :/Depression is making you feel like that, but that isn't how you really are!",1
9115, Love this. I struggled with depression in high school. We need to lift each other up more than we do.,1
9116, oh its okay?! i had a solid week of feeling 'normal' and good and positive. then i slipped back into it and now feel terrible- and in the deepness of the depression. you swear you'll carry on feeling good and you won't slip back into it. and then you do and you hate urself 4 it,1
9117, No. I went straight to depression.,1
9118,"Famous mum, Chrissy Teigen, has spoken out about post-partum depression. Read more here:   ",1
9119, _Myth I drink my depression away,1
9120,"Don't settle with depression, anxiety or defeat. Jesus wants you to overcome. faith Prayer bible kalamazoo  â¦",1
9121,_ Its just small depression <Emoji: Weary face>,1
9122,Today's depression is brought to you by overwhelming sense detachment followed by past transgressions. It's gonna be a good day <Emoji: Unamused face>,1
9123,took the fattest depression/sickness nap wow I'm proud of myself,1
9124,People are not their mental illnesses!   â¦ mentalhealth bpdchat depression anxiety MentalIllnessMisconceptions mentalillness,1
9125,1 in 4 SA workers suffers from depression  â¦?shared via ,1
9126,i love depression hour  pic.twitter.com/XKaD37qE7O,1
9127,"GeneChat Large-population studies that look for such associations resulted in the list of genes that if mutated create a risk for depression or anxiety. Ex, MDD1 and MDD2 are related to major depression disorders. But the list is growing and there are many genes playing role NS",1
