,text,new_label
3569,Hello world! Listen the Radio Dabas online:  left corner above - PRï¿½BA SZERENCSE ,0
3570,: convocation is once a year. Most MTechs finish their thesis a little after the  convocation. ,0
3571,  Got to get when you can here! ,0
3572, plz check ur direct msgs' inbox ,0
3573, Sweet dreams! ,0
3574, algebra is easy lucy ,0
3575,trying to get an itunes receipt and listening to tinpan orange ,0
3576, that depends on how well you pull it off! ,0
3577,3's Daniel Merriweather's new album - specifically Water and a Flame...his song with Adele ,0
3578,anyone want a blog they want linked to? looking to fill out my blogroll   from _bach new look !  ,0
3579,1st Wedding Anniversary today   Here's to many more blissfully happy years together.,0
3580,Finally Twitter is working ,0
3581,Hi bethy ,0
3582,"_benson We all definitely need more up!  Down with down, have some more up, 7up, 1ups and fruit rollups. ",0
3583, Yeah it's 7:00AM here. Still too early... Good morning to you ,0
3584,What a day!!!  Went to 3 locations of Hillsong Church and love our Kidmin more than ever!!! Now time to REST ,0
3585, awww thanks haha  added you xx,0
3586,Doing sketchy things. Love my life ,0
3587,"welll, ie got people to go to town with   let me know if your gna come DDDD",0
3588,  good morning. not feeling so great - up til 3 watching Abandon play. Amazing gig though ,0
3589, Redesign looks good. Pleasant improvement ,0
3590, aww hope you feel better. im about to drop so ill talk to you tomorrow  love you loads gorgeous xoxxx,0
3591,  Morning hope you got some nice coffee to go with the croissants ,0
3592,_ WOW Beth i just went on your myspace and listened to the tracks u recorded. They're really good!! ,0
3593," O: i was thinking barney the dinosaur live, but okay ",0
3594,hahaa..you will not!did you watch SFTW?  i hear u went for dinner on thurs night with anishahow is she??,0
3595,I'm gonna go out in the sun for a bit before I have to the meal ,0
3596,"  - awwwwwwwwwwwwwwww, he's so cute ",0
3597, WOW! What's this partnership all about? ,0
3598,_reuvers Poo to that. Time to move out perhaps? Back to Melbourne? ,0
3599, hello misha! it has been a long time. ,0
3600,Just woke up.  I missed my tweetee,0
3601, Heya  I'm fine thanks  wuu2 today? xxx,0
3602,Think the sun has melted everyone away like ice lollies.lol ,0
3603,i need a few more comments on the next part of trouble  then i'm gonna post the second part of you/i. comment y'all ,0
3604,happy birthday to me  3,0
3605,  i saw that video your mum put up of you singing the climb. very good  nice voice   Do you like Miley Cyrus?   Xx,0
3606,finished art ,0
3607,OMG! am so bored my pussys poppin! ,0
3608,Happy Sunday - going for a ride on the Harley today ,0
3609, its fine be inapropriate we dont care ,0
3610,Playing shit loads of TF2 ,0
3611,Merlin - he manages to escape being sprung again - lucky thing ,0
3612,ok im going out now ,0
3613, Am stuffed!!! Good tunes by the way ,0
3614,GOOD MORNING! I slept so nice n woke up peaceful n painless 4 once.  ,0
3615,"btw, im totally tweeting every bit of this  so if you dont like a7x, you can go suck a fat pne (y)",0
3616,Guy next to me on the bus has a HUGE ring. Huge as in really huge. Will try to twitpic. ,0
3617, James' house ,0
3618,cooking with my brother for my granny - a day off from work for our dear one ,0
3619,Sun is shining... Going to studio... Or go to the sea? That's the problem... ,0
3620, Might sound a little cheesy but it's the truth.  I'm definitely gonna see the Movie more than once cuz I wanna experience the,0
3621,hey all!  what's up? Just got up after a nap and had dinner. so how are we all doing?,0
3622," Nice to meet you, you too! ",0
3623, Claires on the first page with about 550 votes ,0
3624," entroncamento  ya know whos comming here too? Blasted mechanism, rita guerra, joao pedro pais..8D  but are u ok?",0
3625,Alan's WoW guild said hi to me whilst preparing for a raid.  It made my day. ,0
3626, ... Hmm. And I don't know what it's for seriously  ,0
3627,"???, ???????? 30?? ??????? ? Subway.???-??? ",0
3628, awwww thanks 4 showing Me luv!!!  hmm,0
3629,_ oh yeah!! haha ok ok just catch me somewhere in school ,0
3630, hey romy  What do we have to do for french? o.O,0
3631,thanks  .. like this swing  ? ,0
3632,HELLO BEAUTIFUL DONT FORGET UNTOUCHED   is on itunes now ,0
3633," enjoy your beautiful day, Ricki! It's sunny here, too! ",0
3634, I shall come keep you warm ,0
3635,time for lunch ,0
3636,"  made me high, joy all around ... ",0
3637,"on a happy note, weddings are awesome, and i'm gonna make sure my wedding has an open bar!   ",0
3638, thats absolutely amazing!You're a dark horse!A lady of many talents!excellent ,0
3639,Sunday mornings made for listening to the Beatles ,0
3640, morning hun  wow ur awake early!! xxx,0
3641,Mother's Day in Sweden today! ,0
3642,"Got a sweater, now I'm warm. ",0
3643,I have my Lo back!!! She slept like a rock!! YAY!!! Going to my sister's bday party today.  We're ALL going!!  Double YAY!! LOL!!,0
3644, ah well i'm glad i could introduce you to PER ,0
3645,New glasses! ,0
3646, Thank you so much...  Lovely to catch up!,0
3647, - Check out what amp i'm playing through this morning. ,0
3648, comeon didn't u think it was a little silly when he parachuted out of the helicopter?  it did have alot of twists  turns ,0
3649,19 days till l.a!!!!!!! aaahhhhhh..so excitedddd ,0
3650,"@ sushi tei with my mum, grace and charles! Hahaha   - ",0
3651, enter shikari went to my school ,0
3652,and his band AROUND A have just won the Battle Of The Bands rock contest!! WE LOVE YOU! ,0
3653,Valentine's are lame so I'll bring you flowers just for no occasion ,0
3654,Three cheers for Harry Potter ! ,0
3655,I just saw Night at the Museum 2.  It was AWESOME! ,0
3656,"But I have my secret weapon. By making fun of myself in a silly way, I make myself smile and be cheery! ",0
3657,After monday im going to shop shop shop shop till i drop  thankyou GSS,0
3658,Went food shopping this morning and going to do a BBQ later because its total clear blue sky - _fanblog will be pleased with me ,0
3659,A guy called BalusC is pissed at me at sun forums  ,0
3660,"is enjoying a tall, cool glass of pineapple, mint and lime juice. Virgin mojito katanya... ",0
3661," HAHAHAHAHA.  OMS, that made me laugh a lot.   xx",0
3662,peace  love ,0
3663," Where's C, where, where bzzzzz, bzzzzz, bzzzzzz ",0
3664,watching indiana jones and the kingdom of the crystal skull. ,0
3665,in the sunshine revising sunbathing maths and media.booming common dreads out into the garden  fuck the neighbours eh ?,0
3666,"Happy Birthday Big Ben, may you chime for another 150 years and more ",0
3667, I was joking... As you should know but you are still being followed so all is not lost ,0
3668,is about to go out and relax in the sun ,0
3669,"Hottop is online in Austin, Texas and Looking for Friends, Fun  Maybe more.  - ",0
3670, it's a blessing and a curse.  I glow in the dark ,0
3671, 1. I don't get a prayer? 2. Pass on the picnic got studying...sigh. Twitpic stuff for me! ,0
3672,loves her antam-but-still-kinda-sucessful loose curly hair! ,0
3673," Howard, thank you, I appreciate your wisdom, U understand me  chatting with you was very fine, Ill let you know after the elec.",0
3674,chilling in the sun and just joined twitter ! ,0
3675, jensen and danneel bought a cockapoo named Icarus. And he said on stage that he loves her. ,0
3676,"Finally, my bedroom is tidy. OCD does come in handy ",0
3677, Thanks! That's definitely helpful! ,0
3678, Im preparing some heckling material for your CF+pdf session  btw if you want to cover images and compression feel free ;),0
3679,Cocktails + balcony  +scorching day = heaven ,0
3680,Super bored... someone leave me a reply ,0
3681,I'm actually sticking to my diet. I am impress ,0
3682," - At the London theatre, Thriller Live. I like the interior  school ",0
3683,"1. Kaskade - 4am (adam k  soha remix), 2. Dakota - Johnny The Fox, 3. Mr.Pit vs. AB - Shana Can't Sleep. 3 Tracks I dropped at Motion. ",0
3684, that's cool ,0
3685,jumpin' on my trampoline ,0
3686,"i vote for you about 130 times now haha , you will win for sure  loove youuu! keep smiling don't be nervous for tonight ^^",0
3687, Hey Nic! Have fun in Indonesia! Bet you'll have an unforgettable time. Traffic is kinda nuts there.  See you in 4 days! ,0
3688,I can't get over the weather  I'm loving it!!,0
3689,_stacey wish that I cld stay in bed but there's a whole world outside these doors for now I'm watchin reruns of 90210 ,0
3690, I REALLY DNT CARE CAUSE THE CAVS AINT MY TEAM.. JUST DIDN'T WANT ORLANDO TO WIN.. ,0
3691, reaallly im on chapter 43 - - dont ruin it!! ,0
3692," Yay, me too!  How long is yours? Mine's three pages xP",0
3693,"is exhausted, but has so much to do this week! Prom last night was fun ",0
3694,star trek is an amazing film! now in nandos waiting for food ,0
3695," thanks... easy, but the kind of thing you could spend hours figuring out ",0
3696,_banana25...  It's only good on Thursday...I miss out on having Sunday off tho.,0
3697,  DON'T LET ANYTHING OR ANYONE STOP YOU FROM ACCOMPLISHING YOUR DREAMS.  ,0
3698,"Woke up from an afternoon nap, feeling miserable. Read an article about choosing my emotions by choosing my beliefs. I chose joy ",0
3699, well said ,0
3700,"If anyone wants to spend their money, I would love a Wii ",0
3701,Just hanging with my mama.  I'm making a funny face cuz I have a mouth full of apple     ,0
3702," Wait, wait, wait. Do you mean to tell me that news/info on twitter isn't 100% reliable?  How is Chelsea anyway?",0
3703, oh hugging dreams are the very best kind! you wake up in such a good mood ,0
3704, Yoko I miss you too ,0
3705," Yeah, I think I will too - that's an impossibly good deal ",0
3706, anything for my favourite brother ,0
3707,do they except us to study in this weather? its so warm and sunny to study..wel thats my excuse ,0
3708,  - and haha i see twitter in the background ,0
3709, yeah pink I love u too and I am a cat !!! Love your work  Meoooooooow,0
3710,demi lovato's song back around is AMAZING ,0
3711, apparently we're neighbors then  Friends place is actually 38th/Greenway,0
3712, messed up the timing and missed you at BEA on Friday.  from a distance looked like you had some good traffic. ,0
3713,"im at nathans house, gunna go play some WoW and COD4 and Killing Floor!! ",0
3714,Our BBQ went well. Pineapple was perfect. Kat added lime to everything. Now we have nothing in the world to do ,0
3715, no idea :S  yeah I LOVE the Jobros  bye I must go (L),0
3716,_red no cause ya'll might hear me snoring. I can't seem to stay awake. Thanks though. Besides...I'll have the podcast ,0
3717,*Yawn*  Good morn-ting everyone! ,0
3718,havin' a good old jiggle to groovy music ,0
3719,Just finished leadig praise and worship. By His Grace was awesome...but not nearly as awesome as God is. ,0
3720, Wow you're fast ! Enjoy your lunch ,0
3721,beautiful morning  time to see what everyone is doooing,0
3722, I'm envious of all the web events you get to attend in NY. Absolutely nothing like that here in Halifax ,0
3723, haha exactly  and the kiss was just awesome  Team Edward alllll the way!!  what about you?,0
3724, - This doggie looks like my Bailey. ,0
3725,getting married on wednesday to jonathen willinger ,0
3726, i dooooo ,0
3727,"  hey thanks! seems a pity not to eat it, sounds fairly nutritious ",0
3728,"has found and bought an awesome book today, entitled: 20 Essays Written by 20 Somethings. ",0
3729," just surfing, did some schoolwork, getting ready to go to chuch. We need to know what YOU are doing  Is mylo behaving? ",0
3730, nice twitpic! When you write a caption you have to put it in the subject line. ,0
3731,Emily is confused over food. I love her ,0
3732,beautiful day to be outside listening to the birds  in the sunshine ,0
3733,"Well, i didnt try  I used to do it in my Bike..Today did it in friend's new R15, in ECR. Bike skided in mud. Got to change side Doom slate",0
3734,Listening to Cher ,0
3735, the brides mom was so cute. She asked me how much all the film would cost to shoot the whole wedding ,0
3736, The kids are 7 and 2 ,0
3737,"My my , just like that ? You wave the white flag ? ",0
3738,"Congratulations , Lizzie and family   uncle ! ",0
3739," Thank u for the well wishes in regards to my day at the beach. We had a great time, and I got  several shades darker ",0
3740, One donut is a snack and 4 are a meal? No wonder North Americans are so pudgy. ,0
3741, Thank you so much for the quote. I really appreciate it. ,0
3742,Going to the cinema with Karlijn  Stephanie; 17 again ,0
3743,"  oh snap, u got 5 kids????!!! lets get together and combine kid forces to abuse the welfare system ",0
3744," Ok, I will pick you.  Congrats! You've won a signed copy of Barracuda by Mike Monahan. Pls DM me with mailing info. ",0
3745, I've just returned home from a day by the coast! It was akin to July 4th! ,0
3746, - My Saturday Night ,0
3747,"Outski, Dunno what I'm doing today. Call me ",0
3748, with ya!!!!!!!!!!.............10yearsofEnema ,0
3749, ok you travel a lot-why are you in Seattle? Say hi to my friend Rick for me ,0
3750," Come to England, you can have a nap here  Hows the pregnancy goin? x",0
3751, very very very happy and slightly skinny  xx,0
3752,Bouncing on the trampoline   ,0
3753,once libertas get 0 seats i'll be happy  eu09,0
3754,"goin on the boy's boat, gonna have breakfast in leschi ",0
3755,NEW SHOES!!!  thanks Lizzie!!! ,0
3756," yup, we have tickets ",0
3757,"Yankees game, Bob Marley and lunch downtown Orlando  Ill miss this",0
3758,Good morning ,0
3759,in the sun heading to ryan's can't wait for catch up beers in the sun. It's been a goooood weekend!   ,0
3760, loved your cover ,0
3761,Resting from Rocking Space Jam with Atomic Babies- Udachi and us ,0
3762, hey  just wondering whereabouts in uganda you guys went? im going in july so was wondering if im going to the same place  xx,0
3763, thanks!  in da house !! ,0
3764, cool  what was your highlight game last year? I thought it was good to see Res Evil 5 early. Crash Commando was fun too,0
3765,Sold a quilt  made friends ane having a fun time!,0
3766, is a beast yall betta follow him now b4 yall hear his stuff on the radio!!!...u the best homie!! ,0
3767,Going to the movies with some of my gymnastics teamates ,0
3768," -- yayy u laughed  i put the pictures on myspace, but i dnt have u as a friend ",0
3769, i enjoyed the live chat too  i am great. last week of school  so how are rehersals going?,0
3770,"_Kayy ummm... okay, well whatever IT is, it can't sing all that well? Katy Perry sings it better, mayne. ",0
3771,Is watching Harry Potter and the Goblet of Fire ,0
3772,Hey my twittzlez just bn busy latle'. time to float and rise to the top.  Make it do waht it do!  v-erse,0
3773," had me a sleep in today.. took a sleeping pill last night, thought I deserved one   Back n forth from the kitchen today ",0
3774,I ain't driving u no more miss daisy! ,0
3775,watching a cheerleading competition on ESPN2. happy days ,0
3776,OK going to get in the shower...I need to wake up from last night's excursions...   be back soon!,0
3777,is at church with Joshie. This place is huge! ,0
3778," haha, in our new little house silly.  dont worry. youll get your sleep. love you!",0
3779, They are. ,0
3780,broke the front door off it's hinge last night. how? angry-drunk door slam ,0
3781,Going to flea markets across the land.  Found a replacment NES! ,0
3782, Im so excited for your album! ,0
3783,I'm a LONE SOLDIER. Aha! That's how I really feel. Taking on my own battles  shit. Spare me the drama  just let me do it! ,0
3784, Eventually got my phone working again. But not before I labelled you a faerx.  ,0
3785, I voted  Multiple times  But it's not on TV here tonight  I wonder when I'll see it...,0
3786,rubbish day of revision ..  but Take That in 8 days !! ,0
3787, you're gonna love it ,0
3788, you might want to check out the Dolphin Hotel pool and beach. It's very refreshing and order lunch poolside ,0
3789,_sinha u shud have taken a diploma....  wud have helped ur cause...,0
3790, oh did u!? fa sho fa sho im glad! ,0
3791," sheesh you didnt have to sign off, get back on AIM when you're done with the essay ",0
3792,Hmmm waiting for those restless morning. Summer classes...man I can't wait. Idk why I'm so excited!! ,0
3793,  - Holla for the Irish flag!!  Good luck ladies!,0
3794,Had a great day with the family ,0
3795,"Work, yet again. Not done till 7. Lunch time now at least ",0
3796, Do you have Facebook?  Loveee youu.,0
3797, Congrads you guys deserve to win!!! ,0
3798," it's off :p, hope that improves your mood Tom ",0
3799,is happy that  is recording a video for 22 defo my second fave of the its not me its you album ,0
3800, no. I only have his email and he is following me. U can send him a direct msg so he can get it. ,0
3801, A phenomenal chorizo chimichanga - or  haha ,0
3802,its hella hot outside so i am gonna get in the pool ,0
3803,So pretty today. Going tan ,0
3804,getting ready to go out and see 'Wolverine' with my men! ,0
3805, your welcome! ,0
3806,24 hours from now I will be a homeowner!  ,0
3807,Beautiful day ,0
3808, the drinking age in Spain is 14. So it's fine there too. ,0
3809,right i be off out love you all  xx,0
3810, yup! i can imagine things can only get better ,0
3811, you are most welcome ,0
3812, Good luck! ,0
3813, r u accepting applications ,0
3814,just napped so hard that he slept on top of his keys. :S now off to magoffin! ,0
3815, nahh.. horse show  and then saw these BIG ass trees.. lol and i mean fuckin HUGE.,0
3816,_C Missed your twitter updates. glad to have you back ,0
3817, yay auditions  Good luck!!,0
3818, yeah i didn't change it i was just touching up the roots. my hair is dyed black right now. i look like betty boop ,0
3819, nononono... i'm totally peachy!! I just realized something mindblastic all of a sudden.. that's all ,0
3820, :beep beep: ,0
3821, ,0
3822,Is now baptized!  we have an awesome god.,0
3823,OMG it feels so good to take that damn girdle off... You skinny bitches don't know nothing about that kind of pain... Lucky You ,0
3824,in ecktown city.... fireworks... niice!! and then watching dvds!! and then... good night ,0
3825, There is no difference lol Kabbalah is the mystical side of Judaism that's all ,0
3826,is bored. but shit happens. Wanna just call quits now. BUT LEEDS ,0
3827, i do not ... DM it to meee pleaseee ,0
3828, .. with a bat up her nightdress ,0
3829,  - You poor thing! Use a bronzer  You still look great!,0
3830,"L and I had a great time rowing on the Avon at Bath and she has learnt to row! Now cooking dinner, about to watch House  Feel knackered.",0
3831, I watched the movie Australia a while ago...its a good movie..Nicole is wicked good in it. ,0
3832,...so one of these days i'm gonna learn how to properly tie a chicken ,0
3833,at Amanda's and Grandma's birffday party lol. Rockin' out on my guitar  (No not guitar hero guitar!),0
3834," wow, the sun... almost as beatiful as you  3",0
3835,Just experienced the world's largest Hershey's bar ,0
3836, I'm gonna check them out online tmrw! ,0
3837,Please! Vote For florencia __colors and for me obviesly  They Need Wins MTVLA!! Please!! ,0
3838,"All day Im at home and Im studying...soo fuckin' boring,but tomorrow will be fun!go to bed now - good night everyone - ttyl  x0x0",0
3839, you look so pretty in your gown!  summer*09,0
3840, where can we vote? ,0
3841, LOL kk  your a cuteeeh,0
3842,Hey   SUPERMAN!!! Woooo i'll Help ya   (souljaboytellem live  ,0
3843,Watching goldmember  ,0
3844," Hi Scott! I'm reading your book now. It's very, very good!! I'll start making my Affirmations Box tomorrow! Thanks! ",0
3845, 19th june baby! ,0
3846," If you hit a pedestrian, make it count!   Be careful.",0
3847,doesn't know what to do :S. Thinks paramore should come to newcastle very soon ,0
3848,_crawford ha...yes ma'am...been branding myself for a while...thanks much..im honored u appreciate ,0
3849, you should have said something to him! ,0
3850, Thanks for the follow  (um),0
3851,"Just back from a lightening visit to Dublin, my brand new baby niece is a peach  That just wasn't enough time... ",0
3852, Not today  But soon!,0
3853, Books on tape or cd makes the drive interesting. Hope this helps ,0
3854," You are a very bright and confident woman, Kelsey, you will be fine.  ",0
3855,  My pleasure - great site - use it a lot for me iPhone ringtones ,0
3856,_h786 just got in from work so no sun today for me but gas a good day ,0
3857, not at all ji - i'm sure you will enlighten me ,0
3858,"If he were Orlando Cabrera, he would call up to the press box and have it changed. ",0
3859,Who's going dancing tonight?? WE MiGHT GO!!! ,0
3860," aha, I love the sunshine it covers everything in a beautiful golden feeling ",0
3861," awesome, ^5! i got my macbook last year for my graduation ",0
3862, Good Luck Ashley!!!! I love you... from Bolivia! ,0
3863," Oh you've watched 3 already, awesome ",0
3864,"AlguÃ©m aÃ­ assiste a sÃ©rie Supernatural? See this, is amazing:   ",0
3865,Had fun at the baby shower....I have procrastinated long enough. Time to write my paper. Maybe! ,0
3866, i love you girl! you's my favorite!!! and you need to go out with angel already  lol you love me i know,0
3867," -- Hey Ben, Its David Berrys daughter Breana from South Boston! Keep in touch!  Love you guys! Yall did great.",0
3868, - 0h! Yeah! the New Moon poster! great ,0
3869,get a grip and get out your safe from the weight of the world just take a second to set things straight... ,0
3870," yup, from your comp. to the right of the tweet where u fav it, there's a trashcan ",0
3871, hola. ,0
3872,"_lopez Hmm..that's some kind of logical thinking your husband has there! Sounds like something mine would suggest, too! ",0
3873,"Hanging out with Whitney, drinking margaritas, and getting ready to grill out!! ",0
3874, Hi Theo ! Will you be stopping in Montreal on your tour ? I'd love to catch one of your shows ,0
3875,"i see the sun peeking already, hoping this week is a lot brighter ",0
3876,I'm excited...I get to meet up with the breeder later today to check out the puppies so I can decided which pup I want.  I can't wait.,0
3877, heyy vic  how are you? miss you girl,0
3878,3wordsduringsex u nasty boy  lmfao,0
3879,artfest  come onn dowwwn haha,0
3880," Thanks! a couple of wee bits, but not much. I swapped woody allen for a reconstructed Joan of Arc Ladybird book, though ",0
3881,Watching my girlfriend having as much fun as my daughter on the Slip-N-Slide. Time for a water balloon fight now. Their going down now. ,0
3882, Keep up the hard work ,0
3883, ahhhhhhh. so hopefully mine will eventually pop up then. good to know ,0
3884,aches after working out....off to my brothers for Raph to swim in the doggie swimming pool he got ,0
3885,Welcome back hon ,0
3886, My day is going good! Its hott outside!!  Love this summer weather.,0
3887," Oh, crap. I said that, too. Still, that Alton Brown idea made me laugh pretty hard. ",0
3888,I have a lot designing to do today. BRING ON THE CHALLENGE BABY! haha. ,0
3889,We are driving over water !! On our way to westkapelle !! Dem a bleach ,0
3890,Got my BB bac!!! Now I can function ,0
3891,Ok Im gone for real this time bbl Thanks again to all my new and old followers we are twit fam  ,0
3892, yeh im not so much into his 'hotness' as his embarrassing of Mr English's decision to irrationally stop saving for super ,0
3893, - Congrats on your graduation  Same to Karl. Love you guys,0
3894," lol. Well, get used to it, love, because I love you! ",0
3895, u are def the hottest WWE superstar ,0
3896,"aha, everyone seems to be dead hot, im alright ",0
3897," nice and quiet here, ",0
3898,Just got homeeeee whaaaatsss goodddd???? ,0
3899, umm u have to click where it says following above someones photo ,0
3900, Dave The Cat Cook  lands on his feet and has 9 lives!,0
3901,Update 400 W.O.W. shocker!! So this goes out to anyone and everyone that is doing exams at the moment  Good luck.. I'll be there with you,0
3902, Talking to you and with another friend and listen Coldplay ,0
3903,I'm kinda sleepy. might go and read eclipse and then sleep. ,0
3904,Have you Gone Loopy?  Group Loop has 5 programs combined for success.....Come join us and start living your Dream ,0
3905, no i love you ,0
3906, AWWW!!!!! What a blessing!  Congratulations!!!,0
3907,"All done! Played really well, shot 75  going to get lunch",0
3908,I am in love with Anna Percy and Ben Birnbaum ,0
3909, Woo! Like to believe our baby TWEET to  helps! She has a great eye. ,0
3910,  - There she is  sooooo adorable!,0
3911," Really? Good for you! Now you have to build it first, don't ya.  I'm sure  to paint will be easy for you!",0
3912,Just had an awesome Sunday evening out  cider and curry= nom ,0
3913,Bout to make some cake and paint signs for my friends car wash! Yeah for choco cake!! ,0
3914," welcome to our world, where the baddest bitch$$ roam ",0
3915,I'm SO hungry! Thank goodness it's almost dinner time! Got to get ready for school tomorrow. Oh wait...it's summer time!!! LOL ,0
3916, - Really now ,0
3917,Rocking out  lol,0
3918,"_anna lmfao no thanks, in bed watching harry potter for the night im content  i think ive polluted my brain enough for the wknd",0
3919,  yayy thanks hah,0
3920,"EstÃ¡ a comeÃ§ar o 'Poltergeist' (Tobe Hooper, 1982) no canal Hollywood! Acho que vou ficar a ver ",0
3921,i cant wait to blow people out of the water with my new stuff.... i have the most amazing people around me now  head down tail up.,0
3922,"Picking up Marie, then heading out to SB for Jubilee Srvc. X-pecting gr8 things 2nite!!!! ",0
3923,This day off has been F-A-N-tastic! ,0
3924," Hope you're not missing Va Bch, DC, Jones Bch or PNC!!! Just sayin ",0
3925, Thanks for helping to spread the word about the book. ,0
3926, Have fun at the mtv movie awards.  ,0
3927,dusk in newport  ,0
